Name,URL,Type,Location,Address,Cuisines,Cost_for_Two,Timings,Rating,Votes
"Mama's Restaurant ",https://www.zomato.com/bangalore/mamas-restaurant-nagawara,Casual Dining,Nagawara,"1, Gate 5, Near Manayata Tech Park, Rachenahalli Main Road, Thanisandra, Nagawara, Bangalore","North Indian, Chinese, Biryani",₹600,"12Noon to 4PM, 7PM to 11PM (Mon-Sun) ","3.3 ",36 votes
"Guru Paradise ",https://www.zomato.com/bangalore/guru-paradise-bannerghatta-road,Casual Dining,Bannerghatta Road,"Opposite AECS Magnolia School, Bannerghatta Road, Bangalore","Chinese, South Indian, North Indian","₹1,000","11AM to 1AM (Mon-Sun) ","2.7 ",164 votes
"New Tasty Cafeteria ",https://www.zomato.com/bangalore/new-tasty-cafeteria-btm,Casual Dining,BTM,"104/2, 1st Cross, 20th Main, Maruthi Nagar Main Road, 1st Stage, BTM, Bangalore","North Indian, Chinese",₹400,"12Noon to 11PM (Mon-Sun) ","3.2 ",81 votes
"New Gongura Grand ",https://www.zomato.com/bangalore/new-gongura-grand-hsr,Casual Dining,HSR,"1136, Above Andhra Bank, 17th Cross Road, Muneswara Nagar, Sector 7, HSR, Bangalore","Andhra, Biryani, North Indian, Chinese",₹450,"11:30AM to 4PM, 6:30PM to 11PM (Mon-Sun) ","3.4 ",274 votes
"The Biryani Cafe ",https://www.zomato.com/bangalore/the-biryani-cafe-banashankari,Quick Bites,Banashankari,"476, 2nd Floor, 9th Cross, Avalahalli BDA Park, BSK 3rd Stage, Banashankari, Bangalore","Biryani, Chinese, Kebab",₹300,"Closed (Mon),12:30PM to 3:30PM, 6:30PM to 10:30PM... ","3.7 ",268 votes
"FrostBite ",https://www.zomato.com/bangalore/frostbite-koramangala-5th-block,"Dessert Parlor,Quick Bites",Koramangala 5th Block,"103, MIG Ground Floor, 17th Main Road, KHB Colony, Koramangala 5th Block, Bangalore","Desserts, Fast Food",₹400,"11AM to 11PM (Mon-Sun) ","NEW ",
"Rajanna Military Hotel ",https://www.zomato.com/bangalore/rajanna-military-hotel-jayanagar,Quick Bites,Jayanagar,"1253, 25th A Main, 41 Cross, 9th Block, Jayanagar, Bangalore",South Indian,₹400,"7:30AM to 4PM, 6:30PM to 11PM (Mon-Sun) ","3.2 ",9 votes
"Roll Er Dokaan ",https://www.zomato.com/bangalore/roll-er-dokaan-jeevan-bhima-nagar,Quick Bites,Jeevan Bhima Nagar,"14, Near BSNL Office, 80 feet Road, Jeevan Bhima Nagar, Bangalore","Street Food, Rolls",₹300,"12Noon to 12Midnight (Mon-Sun) ","3.8 ",67 votes
"Ruchie Rich ",https://www.zomato.com/bangalore/ruchie-rich-electronic-city,Quick Bites,Electronic City,"3-35/2, Phase 2, Electronic City, Bangalore","Biryani, Chinese, North Indian, Kerala, South Indian",₹200,"12Noon to 11:30PM (Mon-Sun) ","3.1 ",9 votes
"Liveat ",https://www.zomato.com/bangalore/liveat-indiranagar,,Indiranagar,"39/7, 5th Cross, 7th Main, Appareddy Palya, Indiranagar, Bangalore","Healthy Food, Mexican, Asian, Continental",₹500,"12Noon to 10PM (Mon-Sun) ","3.6 ",26 votes
"The Charcoal Factory ",https://www.zomato.com/bangalore/the-charcoal-factory-koramangala-6th-block,,Koramangala 6th Block,"Koramangala 6th Block, Bangalore","Pizza, Italian",₹600,"12Noon to 3AM (Mon, Tue, Wed, Thu, Sat, Sun), 1PM to... ","3.4 ",41 votes
"The Kim Chi Chef ",https://www.zomato.com/bangalore/the-kim-chi-chef-whitefield,Casual Dining,Whitefield,"Shop 2,1st Floor, Apple City Complex, Segehalli, Whitefield, Bangalore","Chinese, Thai",₹600,"12:30PM to 3:30PM, 6:30PM to 11PM (Mon-Sun) ","3.6 ",91 votes
"Chatpata India ",https://www.zomato.com/bangalore/chatpata-india-whitefield,Food Court,Whitefield,"Food Court, Ascendas Park Square Mall, ITPL Main Road, Whitefield, Bangalore",North Indian,₹400,"11AM to 11PM (Mon-Sun) ","3.6 ",22 votes
"Cafe Noosphere ",https://www.zomato.com/bangalore/cafe-noosphere-jp-nagar,Café,JP Nagar,"39, Ground Floor, Sai Plaza 2nd Phase, JP Nagar, Bangalore","Chinese, Cafe, Continental, Fast Food, North Indian",₹400,"11AM to 10:30PM (Mon-Sun) ","3.8 ",93 votes
"Stir Fry ",https://www.zomato.com/bangalore/stir-fry-residency-road,Casual Dining,Residency Road,"45/3, Ground Floor, Near Mayo Hall, Residency Cross 1, Residency Road, Bangalore",Chinese,₹500,"11AM to 11PM (Mon-Sun) ","3.7 ",191 votes
"Shagun Sweets and Foods ",https://www.zomato.com/bangalore/shagun-sweets-and-foods-btm,"Sweet Shop,Quick Bites",BTM,"294, 7th Main, 7th Cross, BTM 2nd Stage, BTM, Bangalore","Mithai, North Indian, Street Food",₹400,"11AM to 11PM (Mon-Sun) ","3.5 ",118 votes
"Wow Vada Pav ",https://www.zomato.com/bangalore/wow-vada-pav-hsr,Quick Bites,HSR,"1664, 27th Main Road, 2nd Sector, HSR, Bangalore","Street Food, Burger, Fast Food",₹150,"10AM to 10PM (Mon-Sun) ","3.7 ",27 votes
"Ruchis Point ",https://www.zomato.com/bangalore/ruchis-point-1-banashankari,Quick Bites,Banashankari,"186, 24th Cross, 2nd Stage, Banashankari, Bangalore","Fast Food, Chinese",₹200,"12:30PM to 10:30PM (Mon, Tue, Thu, Fri, Sat, Sun)... ","3.5 ",32 votes
"Hakka Chinese Restaurant ",https://www.zomato.com/bangalore/hakka-chinese-restaurant-koramangala-1st-block,Casual Dining,Koramangala 1st Block,"891/ A, 7th Main Road, Near Wipro Park, Koramangala 1st Block, Bangalore","Chinese, Thai",₹600,"11AM to 4PM, 6PM to 11PM (Mon, Tue, Wed, Thu, Sun)... ","3.7 ",211 votes
"Mast Biryani - Fresh Indian Kitchen ",https://www.zomato.com/bangalore/mast-biryani-fresh-indian-kitchen-marathahalli,Casual Dining,Marathahalli,"2B, Indaus Icon, Kadubeesanahalli, Opposite JP Morgan, Marathahalli, Bangalore","Biryani, North Indian, Mughlai, Fast Food",₹500,"12Noon to 12Midnight (Mon-Sun) ","3.3 ",108 votes
"Hotspot ",https://www.zomato.com/bangalore/hotspot-rajarajeshwari-nagar,Casual Dining,Rajarajeshwari Nagar,"5, Rooftop, 12th Cross, Above Titan Eye Showroom, Ideal Homes Township, Near Jayanna Circle, Rajarajeshwari Nagar, Bangalore","Pizza, Burger, Continental",₹500,"11AM to 11PM (Mon-Sun) ","3.5 ",130 votes
"Bombay Kulfis ",https://www.zomato.com/bangalore/bombay-kulfis-sarjapur-road,Dessert Parlor,Sarjapur Road,"65/1A, Kaikondrahall, Sarjapur Road, Bangalore",Ice Cream,₹100,"12Noon to 11PM (Mon-Sun) ","3.4 ",30 votes
"House of Torte ",https://www.zomato.com/bangalore/house-of-torte-kaggadasapura,"Bakery,Café",Kaggadasapura,"51, 4th Main Road, Malleshpalya, Vignana Nagar, Kaggadasapura, Bangalore","Bakery, Cafe, Burger, Sandwich",₹450,"9:30AM to 10PM (Mon-Sat),12Noon to 10PM (Sun) ","3.2 ",14 votes
"The Dhaba Cafe ",https://www.zomato.com/bangalore/the-dhaba-cafe-hsr,Casual Dining,HSR,"1090/N, Gayatri Towers, 18th Cross, Sector 3, HSR, Bangalore","North Indian, Chinese, Street Food, Ice Cream",₹700,"11:30AM to 11:30PM (Mon-Sun) ","3.3 ",120 votes
"Guru Palace ",https://www.zomato.com/bangalore/guru-palace-bannerghatta-road,Casual Dining,Bannerghatta Road,"53/A, Hulimavu, Bannerghatta Main Road, Bannerghatta Road, Bangalore","Chinese, North Indian",₹450,"11AM to 2:30PM, 6:30PM to 10:30PM (Mon-Sun) ","2.5 ",73 votes
"Panda Xpress ",https://www.zomato.com/bangalore/panda-xpress-hennur,Casual Dining,Hennur,"BSNL Office, Old Police Station Road, Hennur, Bangalore","Chinese, Thai",₹800,"11AM to 11PM (Mon, Tue, Wed, Thu, Sun), 11AM to... ","3.6 ",23 votes
"Kerala Kitchen ",https://www.zomato.com/bangalore/kerala-kitchen-marathahalli,,Marathahalli,"352, 1st Cross, Aswath Nagar, SJR Spencers Road, Marathahalli, Bangalore","Chinese, Kebab, Kerala",₹550,"8:30AM to 11PM (Mon-Sun) ","2.9 ",23 votes
"Hang10 Resto N Cafe ",https://www.zomato.com/bangalore/hang10-resto-n-cafe-btm,"Café,Bakery",BTM,"688, 3rd Cross, 29th Main Road, 2nd Stage, BTM, Bangalore","Cafe, Continental, Bakery",₹700,"11AM to 11PM (Mon-Sun) ","2.8 ",6 votes
"Havmor ",https://www.zomato.com/bangalore/havmor-banaswadi,,Banaswadi,"Balaji Layout, OMBR Layout, Banaswadi, Bangalore","Ice Cream, Desserts",₹200,"11AM to 11PM (Mon-Sun) ","NEW ",
"Sankranti ",https://www.zomato.com/bangalore/sankranti-marathahalli,Casual Dining,Marathahalli,"Chinnapanahalli Main Road, Anand Nagar, Marathahalli, Bangalore",Andhra,₹400,"12Noon to 3:30PM, 6:30PM to 10:30PM (Mon),11:30AM to... ","3.2 ",22 votes
"She Brews ",https://www.zomato.com/bangalore/she-brews-electronic-city,Café,Electronic City,"Site 20, 3rd Floor, Neeladri Road, Near Wipro Gate 16, Electronic City Phase 1, Electronic City, Bangalore","Cafe, Continental, Thai, Chinese",₹400,"11AM to 10:30PM (Mon-Sun) ","3.4 ",78 votes
"Mynt - The Taj West End ",https://www.zomato.com/bangalore/mynt-the-taj-west-end-race-course-road,Fine Dining,"The Taj West End, Race Course Road","Taj West End, Race Course Road, Bangalore","Italian, North Indian, Lebanese","₹2,500","6:30AM to 1AM (Mon-Sun) ","3.8 ",289 votes
"Balle Balle Dhaba ",https://www.zomato.com/bangalore/balle-balle-dhaba-kalyan-nagar,,Kalyan Nagar,"1, Near Canopy Apartment, Horamavu Agara Main Road, Babusapalya Kalyan Nagar, Bangalore",North Indian,₹500,"7PM to 12:30AM (Mon-Sun) ","3.3 ",94 votes
"Happy Belly Restaurant ",https://www.zomato.com/bangalore/happy-belly-restaurant-hennur,Casual Dining,Hennur,"12/1, Near Biozen, Kothnur Circle, Hennur, Bangalore","Chinese, Thai",₹700,"Closed (Mon),12Noon to 4PM, 6PM to 10:30PM (Tue-Sun) ","3.5 ",48 votes
"Mak n Vak - Fyn ",https://www.zomato.com/bangalore/mak-n-vak-fyn-hsr,Casual Dining,HSR,"1554, 19th Main, Sector 1, HSR, Bangalore","Biryani, North Indian, Chinese",₹400,"8AM to 1AM (Mon-Sun) ","3.6 ",166 votes
"Cafe Centralis ",https://www.zomato.com/bangalore/cafe-centralis-new-bel-road,Café,New BEL Road,"80 Ft Road, RMV 2nd Stage, New BEL Road, Bangalore",Cafe,₹600,"8:30AM to 11:30PM (Mon-Sun) ","2.6 ",80 votes
"Juicy ",https://www.zomato.com/bangalore/juicy-2-electronic-city,Quick Bites,Electronic City,"591, Doodatogur Village, Near Velankani, Opposite BWSSB Phase 1, Electronic City, Bangalore","Juices, Desserts",₹150,"9AM to 10PM (Mon-Sun) ","3.4 ",16 votes
"Raravis ",https://www.zomato.com/bangalore/raravis-hsr,Casual Dining,HSR,"1659, 27th Main Road, Sector 2, HSR, Bangalore",Kerala,₹300,"7:30AM to 10PM (Mon-Sun) ","3.4 ",13 votes
"Amdo's Corner Tibetan Foods ",https://www.zomato.com/bangalore/amdos-corner-tibetan-foods-richmond-road,Quick Bites,Richmond Road,"Opposite BDA Complex, Austin Town, Richmond Road, Bangalore",Tibetan,₹250,"12Noon to 10PM (Mon-Sun) ","3.5 ",28 votes
"Beach Hut ",https://www.zomato.com/bangalore/beach-hut-jp-nagar,Casual Dining,JP Nagar,"16, Opposite RV Dental College, 7th Cross, 24th Main, 2nd Phase, JP Nagar, Bangalore","North Indian, Chinese",₹650,"11:30AM to 10:30PM (Mon-Sun) ","2.8 ",128 votes
"Cupcake Couture ",https://www.zomato.com/bangalore/cupcake-couture-whitefield,,Whitefield,"#10061 Tower 10, Prestige Shanti Niketan., Whitefield, Bangalore",Desserts,₹300,"10AM to 8PM (Mon-Sun) ","3.3 ",18 votes
"Celebration 365 ",https://www.zomato.com/bangalore/celebration-365-bellandur,Dessert Parlor,Bellandur,"Ibblur Flyover, Amblipura, PWD Quarters, Bellandur, Bangalore","Desserts, Ice Cream",₹350,"11:45AM to 11PM (Mon-Sun) ","3.1 ",9 votes
"Indore Eat Restaurant ",https://www.zomato.com/bangalore/indore-eat-restaurant-koramangala-6th-block,Quick Bites,Koramangala 6th Block,"466, G 80 Feet Main Road ,Opposite koramangala Bus Depo, Koramangala 6th Block, Bangalore","Street Food, South Indian",₹300,"7AM to 10:30PM (Mon-Sun) ","3.2 ",15 votes
"Freshies Gourmet Salads ",https://www.zomato.com/bangalore/freshies-gourmet-salads-bellandur-bangalore,Quick Bites,Bellandur,"First Floor, Opposite Veeranjayanaya Temple, Ambedkar Circle, Adarsh Palm Retreat, Bellandur, Bangalore",Continental,₹350,"12Noon to 10:30PM (Mon, Wed, Thu, Fri, Sat, Sun)... ","NEW ",
"Cauvery Hyderabadi Biriyani ",https://www.zomato.com/bangalore/cauvery-hyderabadi-biriyani-rammurthy-nagar,Casual Dining,Rammurthy Nagar,"93, NL Arcade, Dooravani Nagar, Rammurthy Nagar Main Road, Rammurthy Nagar, Bangalore","North Indian, Biryani",₹550,"11:30AM to 4PM, 6:30PM to 11PM (Mon-Sun) ","3.0 ",83 votes
"Chopstick World ",https://www.zomato.com/bangalore/chopstick-world-basaveshwara-nagar,Casual Dining,Basaveshwara Nagar,"5, 1st Main, 2nd Block, 3rd Stage, Basaveshwara Nagar, Bangalore","Chinese, North Indian",₹750,"11:30AM to 11:30PM (Mon-Sun) ","3.6 ",138 votes
"Kabab Mandra ",https://www.zomato.com/bangalore/kabab-mandra-whitefield,Casual Dining,Whitefield,"P1, KSSIDC Industrial Estate, Next To Phoenix Market City, Whitefield Road, Bangalore, Whitefield, Bangalore","North Indian, Chinese",₹350,"12:30PM to 11:30PM (Mon-Sun) ","2.3 ",122 votes
"Haji Ali Juice Centre ",https://www.zomato.com/bangalore/haji-ali-juice-centre-koramangala-5th-block,"Beverage Shop,Quick Bites",Koramangala 5th Block,"17th H Main Road, Koramangala 5th Block, Bangalore","Beverages, Fast Food, Desserts",₹350,"12Noon to 12:30AM (Mon-Thu),12Noon to 1:15AM (Fri-Sun) ","3.8 ",88 votes
"SpringFennel ",https://www.zomato.com/bangalore/springfennel-1-koramangala-8th-block,,Koramangala 8th Block,"206, 2nd C Main Road, Koramangala 8th Block, Bangalore",North Indian,₹300,"Closed (Mon-Fri),12Noon to 4PM, 7PM to 11PM (Sat-Sun) ","3.4 ",24 votes
"Mamaji's ",https://www.zomato.com/bangalore/mamajis-electronic-city,Casual Dining,Electronic City,"Concorde Anthurium, Next To Wipro Gate 16, Above Punjab National Bank, Neeladri Road, Phase 1, Electronic City, Bangalore","North Indian, Chinese",₹500,"11:30AM to 10:30PM (Mon-Sun) ","3.3 ",318 votes
"Singh Saab ",https://www.zomato.com/bangalore/singh-saab-indiranagar,Casual Dining,Indiranagar,"11, Behind Reebok Showroom, 16th Main, HAL 2nd Stage, Off 100 Feet Road, Indiranagar, Bangalore",North Indian,₹850,"12Noon to 11:30PM (Mon-Sun) ","3.4 ",216 votes
"Bawarchi Biryani Mahal ",https://www.zomato.com/bangalore/bawarchi-biryani-mahal-rajarajeshwari-nagar,Quick Bites,Rajarajeshwari Nagar,"Building 17, Near Global Village Tech Park Back Gate, Mysalasandra, Rajarajeshwari Nagar, Bangalore","Biryani, Andhra, North Indian",₹350,"12Noon to 3:30PM, 6:30PM to 10:30PM (Mon-Sun) ","3.0 ",64 votes
"Cinnamon ",https://www.zomato.com/bangalore/cinnamon-hsr,Casual Dining,HSR,"78, Ground Floor, Right Wing, 11th Main, 14th Cross, Behind BDA Complex, HSR, Bangalore","North Indian, Chinese",₹550,"12Noon to 3:30PM, 6PM to 11PM (Mon-Thu),12Noon to... ","3.6 ",398 votes
"De Thaali ",https://www.zomato.com/bangalore/de-thaali-jayanagar,Casual Dining,Jayanagar,"137/4, 8th Main Road, 27th Cross, Jayanagar, Bangalore","North Indian, Chinese",₹450,"10AM to 10PM (Mon-Sun) ","3.6 ",81 votes
"Chubalas Curry And Rice ",https://www.zomato.com/bangalore/chubalas-curry-and-rice-kammanahalli,Quick Bites,Kammanahalli,"21, Nehru Main Road, Kammanahalli Circle, Kammanahalli, Bangalore","Naga, Goan, Seafood, Chinese",₹550,"12Noon to 11PM (Mon-Sun) ","3.7 ",167 votes
"Atta Galata ",https://www.zomato.com/bangalore/atta-galata-koramangala-5th-block,Quick Bites,Koramangala 5th Block,"134, KHB Colony, Koramangala 5th Block, Bangalore","Bakery, Fast Food",₹200,"Closed (Mon),11AM to 8PM (Tue-Sun) ","3.8 ",170 votes
"The Sandwich Club ",https://www.zomato.com/bangalore/the-sandwich-club-2-btm,Quick Bites,BTM,"3, 18th Main Road, 3rd B Cross, BTM Layout 2nd stage , Bangalore, BTM, Bangalore",Fast Food,₹250,"6PM to 11PM (Mon-Fri),12Noon to 4PM, 6PM to 11PM... ","3.7 ",51 votes
"M.M.A. Kabab's & Biriyani Center ",https://www.zomato.com/bangalore/m-m-a-kababs-biriyani-center-brookefield,Quick Bites,Brookefield,"Opposite Silver Line Bakery, Kundanahalli Gate, ITPL Main Road, Brookefield, Bangalore","North Indian, Mughlai, Chinese, Rolls",₹300,"11AM to 11PM (Mon-Sun) ","3.1 ",297 votes
"Dwaraka Grand ",https://www.zomato.com/bangalore/dwaraka-grand-kumaraswamy-layout,Casual Dining,Kumaraswamy Layout,"55, Sri Manjunath Arcade, Kumaraswamy Layout, Bangalore","North Indian, South Indian, Chinese",₹500,"7AM to 10PM (Mon-Sun) ","3.5 ",59 votes
"The Mylapore Cafe ",https://www.zomato.com/bangalore/the-mylapore-cafe-hsr,Quick Bites,HSR,"13, AB Square,14th Main, Sector 5, HSR, Bangalore",South Indian,₹150,"7:30AM to 10PM (Mon-Sun) ","3.5 ",44 votes
"Currylicious ",https://www.zomato.com/bangalore/currylicious-1-jakkur,,Jakkur,"8, 14/8-8, Galaxy Enclave, Jakkur Plantation, Jakkur, Bangalore","South Indian, Mangalorean, Kerala",₹500,"11AM to 10PM (Mon-Sun) ","3.9 ",44 votes
"Mahadii's ",https://www.zomato.com/bangalore/mahadiis-kammanahalli,Casual Dining,Kammanahalli,"3rd E-F Cross Road, AravindNagar, Yadava Layout, Ramaiah Layout, Kammanahalli, Bangalore","Andhra, North Indian, Chinese",₹600,"12Noon to 11PM (Mon-Sun) ","3.3 ",79 votes
"The Alphaa ",https://www.zomato.com/bangalore/the-alphaa-bommanahalli,Casual Dining,Bommanahalli,"433/10, Hosur Main Road, Garvebhavi Playa, Bommanahalli, Bangalore","Andhra, North Indian, Chinese, Biryani",₹500,"11:30AM to 4:45PM, 6:30PM to 11:30PM (Mon-Sun) ","3.1 ",47 votes
"Occasions ",https://www.zomato.com/bangalore/occasions-koramangala-4th-block,Bakery,Koramangala 4th Block,"439, 8th Main Road, Koramangala 4th Block, Bangalore","Bakery, Desserts, Beverages",₹400,"10AM to 11PM (Mon-Sun) ","3.9 ",61 votes
"Namma Kudla ",https://www.zomato.com/bangalore/namma-kudla-jp-nagar,Casual Dining,JP Nagar,"18, Near RV Dental College, 5th 'A' Cross, Marenahalli, 2nd Phase, JP Nagar, Bangalore","Mangalorean, North Indian, Chinese",₹350,"11:30AM to 3:30PM, 6:30PM to 11:30PM (Mon-Sun) ","3.5 ",146 votes
"Kakal-Kai Ruchi ",https://www.zomato.com/bangalore/kakal-kai-ruchi-1-jp-nagar,Casual Dining,JP Nagar,"1/8, Big Baazar, Kothanur Dinne Main Road, 7th Phase, RBI Layout, JP Nagar, Bangalore","North Indian, South Indian, Chinese",₹500,"7AM to 10:30PM (Mon-Sun) ","3.2 ",183 votes
"Dev Sagar - Food Street ",https://www.zomato.com/bangalore/dev-sagar-food-street-basavanagudi,Quick Bites,Basavanagudi,"11/2, Old Market, V V Puram, Basavanagudi, Bangalore",Street Food,₹150,"2PM to 11PM (Mon-Sun) ","3.7 ",119 votes
"Calcutta Victoria Chat House ",https://www.zomato.com/bangalore/calcutta-victoria-chat-house-jeevan-bhima-nagar,Quick Bites,Jeevan Bhima Nagar,"Jeevan Bhima Nagar Main Road, Jeevan Bhima Nagar, Bangalore",Street Food,₹150,"11AM to 11PM (Mon-Sun) ","3.3 ",186 votes
"Meghana Biriyanis ",https://www.zomato.com/bangalore/meghana-biriyanis-nagawara,Quick Bites,Nagawara,"82, Opposite Manyatha Tech Park, Outer Ring Road, Nagawara, Bangalore","Andhra, Biryani",₹300,"12Noon to 4PM, 6:30PM to 11PM (Mon-Sun) ","3.1 ",25 votes
"Grandma's Recipe ",https://www.zomato.com/bangalore/grandmas-recipe-sarjapur-road-bangalore,,Sarjapur Road,"12, Anjaneya Swamy, Nilaya, 2nd Cross, Someswara Layout, Doddakannahali, Sarjapur Road, Bangalore",Biryani,₹400,"11AM to 11PM (Mon-Sun) ","NEW ",
"Kerala Mess ",https://www.zomato.com/bangalore/kerala-mess-koramangala-1st-block,Quick Bites,Koramangala 1st Block,"11, Opposite Karnataka Vedika Office, Venkatapura Main Road, 7th Cross, Koramangala 1st Block, Bangalore",Kerala,₹200,"8AM to 11PM (Mon-Sun) ","NEW ",
"Al Habibi Restaurant ",https://www.zomato.com/bangalore/al-habibi-restaurant-btm,Quick Bites,BTM,"Narayan Gowda Layout, 1st Stage, BTM, Bangalore","North Indian, Chinese",₹300,"12Noon to 11PM (Mon-Sun) ","NEW ",
"Viceroy's Sarathi ",https://www.zomato.com/bangalore/viceroys-sarathi-indiranagar,"Casual Dining,Bar",Indiranagar,"421, Krishna Temple Road, Off 100 Feet Road, Indiranagar, Bangalore","North Indian, Chinese",₹750,"11AM to 11PM (Mon-Sun) ","3.3 ",115 votes
"Earthen Bowl ",https://www.zomato.com/bangalore/earthen-bowl-marathahalli,Café,Marathahalli,"Shop 2, Survey 41, Ferns City Road, Doddanekundi, Marathahalli, Bangalore","Cafe, Italian",₹700,"11AM to 11PM (Mon-Sun) ","3.6 ",49 votes
"Chickpet Donne Biryani House ",https://www.zomato.com/bangalore/chickpet-donne-biryani-house-kammanahalli,Quick Bites,Kammanahalli,"2, Ground Floor, Kammanahalli Main Road, Jal Vayuvihar Circle, Kammanahalli, Bangalore",Biryani,₹400,"Closed (Mon),12Noon to 4PM, 7PM to 11PM... ","3.5 ",51 votes
"Ginger & Garlic ",https://www.zomato.com/bangalore/ginger-garlic-brookefield,Quick Bites,Brookefield,"D-170, 4th Cross, 1st Main Street, ITPL Main Road, Kundalahalli Colony, Brookefield, Bangalore","North Indian, South Indian, Chinese",₹300,"12Noon to 3:30PM, 6PM to 10:30PM (Mon-Fri),8AM to... ","2.8 ",23 votes
"Chakum Chukum Calcutta On A Roll ",https://www.zomato.com/bangalore/chakum-chukum-calcutta-on-a-roll-indiranagar,Quick Bites,Indiranagar,"901/2, 7th Main Road, 4th Cross, HAL 2nd Stage, Off 100 Feet Road, Indiranagar, Bangalore","Fast Food, Rolls",₹450,"11:30AM to 11:30PM (Mon-Fri),11:30AM to 12Midnight... ","3.7 ",1340 votes
"Parantha Singh ",https://www.zomato.com/bangalore/parantha-singh-kalyan-nagar,Quick Bites,Kalyan Nagar,"01, Ground Floor, 5th Main, 2nd Block, HRBR Layout, Kalyan Nagar, Bangalore",North Indian,₹300,"11AM to 11PM (Mon-Sun) ","3.1 ",9 votes
"Dial A Chaat ",https://www.zomato.com/bangalore/dial-a-chaat-marathahalli,Quick Bites,Marathahalli,"14, 1st Floor, Vinayaka Layout, Doddanekundi, Near Alpine Eco Apartment, Outer Ring Road, Marathahalli, Bangalore","North Indian, Street Food, Chinese",₹400,"12Noon to 3:30PM, 7PM to 12Midnight (Mon-Sun) ","3.7 ",556 votes
"Naidu Military Hotel ",https://www.zomato.com/bangalore/naidu-military-hotel-shanti-nagar,Casual Dining,Shanti Nagar,"9/3, Lalbagh Main Gate, Shanti Nagar, Bangalore","South Indian, Chinese, Biryani",₹600,"11AM to 11PM (Mon-Sun) ","2.5 ",14 votes
"Sanjay Punjabi Dhaba ",https://www.zomato.com/bangalore/sanjay-punjabi-dhaba-sahakara-nagar,Casual Dining,Sahakara Nagar,"Kodigehalli Gate, Byatrayanapura, Sahakara Nagar, Bangalore","North Indian, Chinese",₹500,"11AM to 11PM (Mon-Sun) ","3.6 ",175 votes
"Cafe Alchemist ",https://www.zomato.com/bangalore/cafe-alchemist-btm,Quick Bites,BTM,"13,1st Main Road, Bharathi Layout, Venkateshwara Layout, Suddagunte Palya, BTM, Bangalore","Fast Food, Juices",₹300,"11AM to 11PM (Mon-Sun) ","- ",
"The 3 Musketeers ",https://www.zomato.com/bangalore/the-3-musketeers-whitefield-bangalore,Dessert Parlor,Whitefield,"Near TCS & Vaidehi Hospital, EPIP Zone, Vijayanagar, Whitefield, Bangalore","Ice Cream, Desserts",₹200,"10AM to 10:30PM (Mon-Sun) ","NEW ",
"Sagar Deluxe ",https://www.zomato.com/bangalore/sagar-deluxe-kumaraswamy-layout,Casual Dining,Kumaraswamy Layout,"1761, Near Swathi Nursing Home, 14th Main Road, 1st Stage, Kumaraswamy Layout, Bangalore","South Indian, North Indian, Chinese, Fast Food",₹300,"7:30AM to 10:30PM (Mon-Sun) ","2.6 ",115 votes
"Casino Hotel ",https://www.zomato.com/bangalore/casino-hotel-new-bel-road,Casual Dining,New BEL Road,"185, Near Ramaiah Hospital, Devansandra, New BEL Road, Bangalore","North Indian, Chinese, Rolls",₹500,"11AM to 11PM (Mon-Sun) ","2.8 ",223 votes
"Chef's Gallery ",https://www.zomato.com/bangalore/chefs-gallery-bellandur,Casual Dining,Bellandur,"1st Floor, RMZ Ecospace, Outer Ring Road, Bellandur, Bangalore","Chinese, Italian, North Indian",₹700,"12Noon to 3:30PM, 7PM to 10:30PM (Mon-Sun) ","3.2 ",94 votes
"Brundhavana Food Point ",https://www.zomato.com/bangalore/brundhavana-food-point-kumaraswamy-layout,Quick Bites,Kumaraswamy Layout,"1795, Near Police Station, 13th Main, Kumaraswamy Layout, Bangalore","South Indian, North Indian",₹300,"6AM to 10:30PM (Mon-Sun) ","3.4 ",17 votes
"Aranha's ",https://www.zomato.com/bangalore/aranhas-yelahanka,Casual Dining,Yelahanka,"Yelahanka Doddallapur Road, Near Suman Vidya Samasthe, Yelahanka, Bangalore","North Indian, South Indian, Chinese",₹500,"10AM to 10PM (Mon-Sun) ","3.2 ",16 votes
"Maratha Darshan ",https://www.zomato.com/bangalore/maratha-darshan-cunningham-road,Quick Bites,Cunningham Road,"4, Miller Tank Road, Queens Road Cross, Cunningham Road Area, Cunningham Road, Bangalore","Maharashtrian, North Indian",₹400,"Closed (Mon),12:30PM to 4PM (Tue-Sun) ","3.5 ",87 votes
"Saara's Grill n Spice - SS Lumina Hotel ",https://www.zomato.com/bangalore/saaras-grill-n-spice-ss-lumina-hotel-koramangala-7th-block-bangalore,Casual Dining,Koramangala 7th Block,"4, 20th Main Road, Koramangala 7th Block, Bangalore",North Indian,"₹1,000","11AM to 11PM (Mon-Sun) ","NEW ",
"Raidan Restaurant ",https://www.zomato.com/bangalore/raidan-restaurant-kammanahalli,Casual Dining,Kammanahalli,"33/4, Near Sathya Hospital, Main Road, Kammanahalli, Bangalore","Arabian, Chinese, North Indian",₹450,"11AM to 11PM (Mon-Sun) ","3.2 ",127 votes
"The Raj Pavilion - ITC Windsor ",https://www.zomato.com/bangalore/the-raj-pavilion-itc-windsor-sankey-road,Fine Dining,ITC Windsor,"ITC Windsor, 25 Windsor Square, Sankey Road, Bangalore","North Indian, Continental, Asian","₹2,400","24 Hours (Mon-Sun) ","3.9 ",308 votes
"The Street ",https://www.zomato.com/bangalore/the-street-koramangala-7th-block,Pub,Koramangala 7th Block,"8, 3rd Floor, 80 Feet Road, Koramangala 7th Block, Bangalore","Continental, Mangalorean, BBQ","₹1,200","11AM to 1AM (Mon-Sun) ","3.1 ",13 votes
"Shubh Sweets ",https://www.zomato.com/bangalore/shubh-sweets-hsr,"Quick Bites,Sweet Shop",HSR,"2623, Next To Axis Bank, 27th Main Road, Sector 1, HSR Layout, HSR, Bangalore","Street Food, Mithai",₹400,"10AM to 10PM (Mon-Sun) ","3.6 ",242 votes
"Dande's Hyderabad Biryani ",https://www.zomato.com/bangalore/dandes-hyderabad-biryani-bommanahalli,Casual Dining,Bommanahalli,"268/3, 1st Floor, BVNR Complex, Hosur Main Road, Bommanahalli, Bangalore","Biryani, North Indian, Chinese",₹550,"12Noon to 3:30PM, 6:30PM to 10:30PM (Mon, Tue, Wed... ","2.6 ",166 votes
"Parampara - The Veg Kitchen ",https://www.zomato.com/bangalore/parampara-the-veg-kitchen-electronic-city,Quick Bites,Electronic City,"Shop 6, Opposite Gate 12, Wipro Technologies, Electronic City, Bangalore","North Indian, Chinese, Street Food",₹350,"10AM to 10:30PM (Mon-Sat),Closed (Sun) ","3.4 ",131 votes
"Eggzotic ",https://www.zomato.com/bangalore/eggzotic-domlur,Quick Bites,Domlur,"43, Service Road, Near Domlur Post Office, Domlur, Bangalore","North Indian, Chinese, Biryani, Fast Food, Rolls",₹500,"11:45AM to 3:30PM, 6:30PM to 11PM (Mon-Sun) ","3.8 ",264 votes
