Name,URL,Type,Location,Address,Cuisines,Cost_for_Two,Timings,Rating,Votes
"Swadeshi's ",https://www.zomato.com/bangalore/swadeshis-kanakapura-road,Casual Dining,Kanakapura Road,"15/4, Thalaghattapura, Near KSITC, Kanakapura Road, Bangalore","North Indian, Chinese, South Indian",₹800,"11AM to 11PM (Mon-Sun) ","3.7 ",124 votes
"24@43 - The Oterra ",https://www.zomato.com/bangalore/2443-the-oterra-electronic-city,Fine Dining,"The Oterra, Hosur Road","The Oterra, 43, Phase 1, Electronic City, Bangalore","North Indian, Asian, Continental","₹2,000","24 Hours (Mon-Sun) ","3.7 ",205 votes
"Kartik's Mithai Shoppe ",https://www.zomato.com/bangalore/kartiks-mithai-shoppe-indiranagar,"Quick Bites,Sweet Shop",Indiranagar,"322, Shalini Complex, CMH Road, Indiranagar, Bangalore","Street Food, Mithai",₹150,"10AM to 10:30PM (Mon-Sun) ","3.8 ",70 votes
"Puchkas ",https://www.zomato.com/bangalore/puchkas-marathahalli,Quick Bites,Marathahalli,"Silver Springs Layout, Near Spice Garden Restaurant, Marathahalli, Bangalore",Street Food,₹200,"7:30AM to 11AM, 4PM to 10PM (Mon-Sun) ","3.8 ",506 votes
"Muthashi ",https://www.zomato.com/bangalore/muthashi-btm,Casual Dining,BTM,"3, Brindavan Complex, 20th Main, Maruthi Nagar Main Road, 1st Stage, BTM Layout","Kerala, South Indian, Chinese",₹300,"7AM to 11PM (Mon-Sun) ","3.6 ",127 votes
"Khazana Food Paradise ",https://www.zomato.com/bangalore/khazana-food-paradise-richmond-road-bangalore,Casual Dining,Richmond Road,"16, Aga Abdulla Street, Near Fanoos, Behind Johnson Market, Richmond Road Area, Richmond Road, Bangalore","Biryani, South Indian, Fast Food",₹300,"12Noon to 11PM (Mon-Sun) ","3.9 ",241 votes
"Housefull ",https://www.zomato.com/bangalore/housefull-seshadripuram-bangalore,Casual Dining,Seshadripuram,"86, Shubodaya Building, Railway Parallel Road, Kumara Park West, Seshadripuram, Bangalore","North Indian, Continental","₹1,600","11:30AM to 3PM, 7PM to 11:30PM (Mon-Thu),12Noon to... ","NEW ",
"Hyderabadi Biryani Utsav ",https://www.zomato.com/bangalore/hyderabadi-biryani-utsav-old-madras-road,Casual Dining,Old Madras Road,"1st Floor, Above Dominos, Pai Layout, Tin Factory, Old Madras Road, Bangalore Old Madras Road","Biryani, Hyderabadi, North Indian, Chinese",₹600,"11:30AM to 3:30PM, 6:30PM to 11PM (Mon-Sun) ","3.4 ",154 votes
"Eat Eroo - South China ",https://www.zomato.com/bangalore/eat-eroo-south-china-marathahalli,Quick Bites,Marathahalli,"Home Town, Outer Ring Road, Marathahalli, Bangalore","South Indian, Chinese",₹350,"11AM to 11PM (Mon-Sun) ","3.6 ",144 votes
"Jose's Mess ",https://www.zomato.com/bangalore/joses-mess-btm,Mess,BTM,"Maruthi Nagar Main Road, 9th Cross, BTM, Bangalore","Kerala, South Indian",₹300,"7AM to 9:30PM (Mon-Sun) ","4.0 ",194 votes
"Hyderabad Biryaani Palace ",https://www.zomato.com/bangalore/hyderabad-biryaani-palace-kammanahalli,Casual Dining,Kammanahalli,"407, 1st Floor, 4th Main, Kammanahalli Main Road, Kammanahalli, Bangalore","North Indian, Chinese, Biryani",₹600,"12:30PM to 11PM (Mon-Sun) ","3.2 ",44 votes
"Manasa Fishland ",https://www.zomato.com/bangalore/manasa-fishland-kalyan-nagar,Casual Dining,Kalyan Nagar,"80 Feet Road, Subbianaipalya, Opposite Patil Public School, Kalyan Nagar, Bangalore","Seafood, South Indian, North Indian",₹650,"12Noon to 11PM (Mon-Sun) ","3.8 ",79 votes
"Green Hyderabad Biryani House ",https://www.zomato.com/bangalore/green-hyderabad-biryani-house-whitefield,Casual Dining,Whitefield,"220, Ground Floor, Opposite Prestige Shantiniketan, ITPL Main Road, Whitefield, Bangalore","North Indian, Chinese, Biryani",₹500,"11:30AM to 4PM, 7PM to 11:30PM (Mon-Sun) ","3.2 ",103 votes
"Oh My Biryani ",https://www.zomato.com/bangalore/oh-my-biryani-hsr,,HSR,"47, Ground Floor - Nanda Nilaya, 18th Main Road, Behind Sai Baba Temple, Sector 3, HSR Layout, Bangalore","Biryani, North Indian",₹550,"11:30AM to 2AM (Mon-Sun) ","3.4 ",92 votes
"Momo Jojo ",https://www.zomato.com/bangalore/momo-jojo-jp-nagar,Quick Bites,JP Nagar,"2nd Cross, Kothnoor Village Main Road, Natraja Layout, 7th Phase, JP Nagar, Bangalore","Chinese, Street Food",₹300,"12Noon to 10PM (Mon-Thu),12Noon to 10:30PM (Fri-Sun) ","4.1 ",398 votes
"D-Zaprino ",https://www.zomato.com/bangalore/d-zaprino-new-bel-road,,New BEL Road,"17-B, LKR Nagar, RMV 2nd Stage, L.G Halli, New BEL Road, Bangalore","Fast Food, Burger, Pizza, Sandwich",₹350,"9AM to 12Midnight (Mon-Sun) ","3.8 ",107 votes
"Adithya Biriyanis ",https://www.zomato.com/bangalore/adithya-biriyanis-yelahanka,Quick Bites,Yelahanka,"17/B - 13 & 14, 1st Floor, Opposite Rail Wheel Factory, Yelahanka New Town, Doddaballapur Road, Yelahanka, Bangalore","Biryani, North Indian, Chinese",₹300,"11:30AM to 3:30PM, 6:30PM to 11PM (Mon-Sun) ","3.3 ",54 votes
"Bobacha ",https://www.zomato.com/bangalore/bobacha-itpl-main-road-whitefield,Beverage Shop,"Ascendas Park Square, Whitefield","3rd Floor, Park Square Mall, ITPL Main Road, Whitefield","Beverages, Bubble Tea, Tea",₹300,"11AM to 10:30PM (Mon-Sun) ","3.6 ",20 votes
"Samosa Point ",https://www.zomato.com/bangalore/samosa-point-rt-nagar,Quick Bites,RT Nagar,"Opposite, St. Joseph's Church, CBI Road, HMT Layout, RT Nagar, Bangalore","Street Food, North Indian",₹200,"9AM to 9PM (Mon, Wed, Thu, Fri, Sat, Sun), Closed (Tue) ","3.3 ",26 votes
"Uptown Sliders & Shakes ",https://www.zomato.com/bangalore/uptown-sliders-shakes-hsr,Café,HSR,"647, 27th Main Road, 1st Sector, HSR, Bangalore","Cafe, Beverages",₹550,"11AM to 11PM (Mon, Tue, Wed, Thu, Sun), 11AM to... ","3.6 ",43 votes
"Pepperwood ",https://www.zomato.com/bangalore/pepperwood-1-sarjapur-road,Quick Bites,Sarjapur Road,"6, Gear School Road, Sarjapur Road, Bangalore","Biryani, Rolls",₹300,"11:30AM to 11PM (Mon-Sat),Closed (Sun) ","3.5 ",39 votes
"Laziz Pizza ",https://www.zomato.com/bangalore/laziz-pizza-vijay-nagar,Quick Bites,Vijay Nagar,"6, 1st Floor, Nanda Ashirvad Complex, Canara Bank Colony Road, Chandra Layout, Vijay Nagar, Bangalore","Fast Food, Burger, Pizza",₹350,"10:30AM to 10:30PM (Mon-Sun) ","3.5 ",100 votes
"Kund Indian Barbeque ",https://www.zomato.com/bangalore/kund-indian-barbeque-indiranagar,Casual Dining,Indiranagar,"303, Ashok Terrace, 1st Stage, 100 Feet Road, Indiranagar, Bangalore","North Indian, Mughlai","₹1,100","12:30PM to 2:30PM, 7:30PM to 10PM (Mon-Sun) ","3.7 ",826 votes
"Rajvardhan Foods ",https://www.zomato.com/bangalore/rajvardhan-foods-jayanagar,Quick Bites,Jayanagar,"1291, 25th Main, Near Big Bazaar, 9th Block, Jayanagar, Bangalore","Street Food, Maharashtrian",₹400,"Closed (Mon),10AM to 10PM (Tue-Sun) ","3.4 ",229 votes
"Saffron Vegetarian Cuisine ",https://www.zomato.com/bangalore/saffron-vegetarian-cuisine-banaswadi,Casual Dining,Banaswadi,"2, Maruthi Towers, 9th B Main, Chairmans Layout, 100 Feet Road, Banaswadi, Bangalore","North Indian, Chinese, Continental",₹550,"12Noon to 3:30PM, 7PM to 11PM (Mon-Sun) ","3.7 ",502 votes
"Phulke Ghar Ke ",https://www.zomato.com/bangalore/phulke-ghar-ke-bellandur,Quick Bites,Bellandur,"18/1, HMR Complex, Near Ganesh Temple, Bellandur, Bangalore",North Indian,₹200,"8AM to 11:30AM, 12Noon to 3PM, 5:30PM to 10:30PM... ","3.8 ",226 votes
"Masala Central ",https://www.zomato.com/bangalore/masala-central-frazer-town,Quick Bites,Frazer Town,"15, St.John's Church Road, Cleveland Town, Frazer Town, Bangalore","North Indian, Fast Food, Beverages",₹300,"8AM to 11:30PM (Mon-Sun) ","NEW ",
"Woodstok (Resto - Cafe) ",https://www.zomato.com/Woodstok,Casual Dining,Indiranagar,"3777, Domlur Service Road, HAL 2nd Stage, Off Double Road, Indiranagar, Bangalore","Continental, Italian, Steak, American","₹1,400","9AM to 11PM (Mon, Tue, Wed, Thu, Sun), 12Midnight to... ","3.8 ",1004 votes
"Taza Tawa ",https://www.zomato.com/bangalore/taza-tawa-jeevan-bhima-nagar,Casual Dining,Jeevan Bhima Nagar,"13, Main Road, HAL 3rd Stage, Jeevan Bhima Nagar, Bangalore","North Indian, Chinese",₹550,"12:30PM to 11PM (Mon-Sun) ","3.0 ",87 votes
"Petoo ",https://www.zomato.com/bangalore/petoo-2-hsr,Casual Dining,HSR,"Bhumi Complex, 177, 9th Main Road, 7th Sector, HSR, Bangalore","North Indian, Fast Food, Street Food",₹450,"11AM to 10:45PM (Mon-Sun) ","3.4 ",99 votes
"Nasta Wasta ",https://www.zomato.com/bangalore/nasta-wasta-btm,Quick Bites,BTM,"43, 7th Main, N.S Paliya Road, BTM Layout, 2nd Stage",North Indian,₹250,"9AM to 11PM (Mon-Sun) ","3.7 ",246 votes
"Hotel Janatha ",https://www.zomato.com/bangalore/hotel-janatha-malleshwaram,Quick Bites,Malleshwaram,"27, 8th Cross, Malleshwaram, Bangalore",South Indian,₹150,"7:30AM to 12:45PM, 3:45PM to 8:45PM (Mon, Tue, Thu... ","3.8 ",596 votes
"Red Stone Kitchen ",https://www.zomato.com/bangalore/red-stone-kitchen-marathahalli-bangalore,Casual Dining,Marathahalli,"Above HDFC Bank, Near Indian Oil Petrol Bunk, Kadubeesanahalli Bridge, Kaverappa Layout, Marathahalli, Bangalore","North Indian, Chinese",₹500,"11AM to 3:30PM, 7PM to 11PM (Mon-Sun) ","NEW ",
"Kava - Fairfield by Marriott ",https://www.zomato.com/bangalore/kava-fairfield-by-marriott-rajajinagar,Fine Dining,"Fairfield by Marriott,Rajajinagar ","Fairfield by Marriott, 1/2, 59th C Cross, 4th M Block, Rajajinagar, Bangalore","North Indian, South Indian, Continental","₹1,800","6AM to 12Midnight (Mon-Sun) ","3.8 ",508 votes
"The Daily Bean ",https://www.zomato.com/bangalore/the-daily-bean-hennur,Café,Hennur,"33/1, Papanna Circle, Kothanur Junction, Hennur, Bangalore",Cafe,₹500,"9AM to 9PM (Mon, Wed, Thu, Fri, Sat), Closed... ","3.7 ",34 votes
"Little Orissa Restaurant ",https://www.zomato.com/bangalore/little-orissa-restaurant-indiranagar,Casual Dining,Indiranagar,"32, 18th Main, Off 100 Feet Road, Indiranagar, Bangalore","Oriya, North Indian, Chinese, Seafood, Bengali",₹450,"Closed (Mon),12:30PM to 3:30PM, 7:30PM to 10:30PM... ","3.4 ",306 votes
"Noodle Bar ",https://www.zomato.com/bangalore/noodle-bar-whitefield,Casual Dining,"Phoenix Market City Mall, Whitefield","1st Floor, Phoenix Market City Mall, Whitefield, Bangalore",Chinese,"₹1,400","12Noon to 4PM, 7PM to 11PM (Mon-Sun) ","3.6 ",935 votes
"Hotel Annapoorna ",https://www.zomato.com/bangalore/hotel-annapoorna-majestic,Casual Dining,Majestic,"6th Cross, Gandhinagar, Majestic Area, Majestic, Bangalore",Andhra,₹400,"12Noon to 3:30PM, 7PM to 10:30PM (Mon-Sun) ","3.8 ",139 votes
"Blue Moustache ",https://www.zomato.com/bangalore/blue-moustache-koramangala-7th-block,Pub,Koramangala 7th Block,"116, Industrial Area, Opposite Raheja Arcade, 7th Block, Koramangala 7th Block, Bangalore","Burger, Continental","₹1,000","11AM to 11PM (Mon-Thu),11AM to 12Midnight (Fri-Sun) ","3.5 ",450 votes
"Swensen's ",https://www.zomato.com/bangalore/swensens-jayanagar,Dessert Parlor,Jayanagar,"58, Ground Floor, 4T Block, Opposite Vijaya College, Jayanagar, Bangalore","Ice Cream, Desserts",₹300,"11AM to 12Midnight (Mon-Sun) ","3.8 ",77 votes
"Sidewalk Cafe & Bar - The Paul Bangalore ",https://www.zomato.com/bangalore/sidewalk-cafe-bar-the-paul-bangalore-domlur,Casual Dining,"The Paul, Ring Road","The Paul Bangalore, 139/28, Opposite Embassy Golf Links, Off Intermediate Ring Road, Domlur, Bangalore","European, Italian, Asian","₹1,500","11AM to 11PM (Mon-Sun) ","3.9 ",165 votes
"Krispy Kreme ",https://www.zomato.com/bangalore/krispy-kreme-jayanagar,"Café,Quick Bites",Jayanagar,"Opposite Kala Mandir, 11th Main, 4th Block, Jayanagar, Bangalore","Desserts, Beverages",₹300,"10AM to 11PM (Mon-Sun) ","3.7 ",207 votes
"TAB - Take A Break ",https://www.zomato.com/bangalore/tab-take-a-break-jp-nagar,Café,JP Nagar,"8, 15th Main, 5th Phase, JP Nagar, Bangalore","Cafe, Continental, Italian",₹550,"11:30AM to 10:30PM (Mon-Sun) ","3.8 ",432 votes
"Fine Flavors ",https://www.zomato.com/bangalore/fine-flavors-kanakapura-road,Casual Dining,Kanakapura Road,"253/6 & 7, Panchvati Comforts Premises, Vasanthapura Main Road, Kanakapura Road, Bangalore","North Indian, Chinese",₹700,"7AM to 10:30AM, 12:30PM to 3:30PM, 7:30PM to 10:30PM... ","3.7 ",242 votes
"Simply Indian ",https://www.zomato.com/bangalore/simply-indian-bannerghatta-road,Casual Dining,Bannerghatta Road,"500, 2nd Floor, 2nd Block, 2nd Phase, BTM Layout, 6th Stage, Near Sai Baba Temple, Arekere, Bannerghatta Road, Bangalore","North Indian, Chinese",₹800,"12Noon to 3:30PM, 7PM to 11:30PM (Mon, Tue, Wed... ","3.6 ",497 votes
"Spice Cove - I.V Sanctum ",https://www.zomato.com/bangalore/spice-cove-i-v-sanctum-1-majestic,Casual Dining,Majestic,"34/3-36/1, 5th Main Road, Gandhi Nagar, Majestic, Bangalore","North Indian, South Indian, Continental, Asian",₹750,"7AM to 11PM (Mon-Sun) ","3.4 ",37 votes
"Sri Sai Ram's ",https://www.zomato.com/bangalore/sri-sai-rams-malleshwaram,Quick Bites,Malleshwaram,"48/2, 8th Main, 13th Cross, Malleshwaram, Bangalore",Fast Food,₹200,"9:30AM to 9:30PM (Mon-Sun) ","3.7 ",25 votes
"Kerala Live Restaurant ",https://www.zomato.com/bangalore/kerala-live-restaurant-1-kammanahalli,Casual Dining,Kammanahalli,"43, Swetha Complex, Ramaiah Layout, Kammanahalli, Bangalore","Kerala, North Indian, Arabian, Seafood",₹700,"11AM to 12Midnight (Mon-Sun) ","NEW ",
"Cafe Momoz ",https://www.zomato.com/bangalore/cafe-momoz-kanakapura-road,,Kanakapura Road,"Shop 18, Balaji Complex Gubbala, Subramanyapura, Kanakapura Road, Bangalore",Chinese,₹300,"11AM to 11PM (Mon-Sun) ","3.2 ",14 votes
"Cake Town Cafe ",https://www.zomato.com/bangalore/cake-town-cafe-koramangala-1st-block,"Bakery,Café",Koramangala 1st Block,"296, Nayak Towers, 1st Main Road, Jakkasandra Extension, Koramangala 1st Block, Bangalore","Bakery, Cafe, Fast Food",₹500,"12Noon to 9:45PM (Mon),11AM to 9:45PM (Tue-Sun) ","3.6 ",33 votes
"Mitran Da Junction ",https://www.zomato.com/bangalore/mitran-da-junction-koramangala-6th-block,Quick Bites,"Eat Street, Koramangala 6th Block","Eat Street, 11, 80 Feet Road, Opposite Indian Oil Petrol Pump, Koramangala 6th Block, Bangalore",North Indian,₹600,"12:30PM to 11:30PM (Mon-Fri),12:30PM to 12:30AM... ","3.7 ",47 votes
"Madeena Hotel ",https://www.zomato.com/bangalore/madeena-hotel-hsr,Quick Bites,HSR,"3 Venkoji Roa Kkhane, Behind Salarpuria Apartment, Mangammapalya Main Road, HSR, Bangalore","North Indian, South Indian, Chinese",₹500,"10AM to 12Midnight (Mon-Sun) ","3.4 ",38 votes
"Inhouse Burger ",https://www.zomato.com/bangalore/inhouse-burger-kalyan-nagar,Quick Bites,Kalyan Nagar,"2nd Block, HRBR Layout, Kalyan Nagar, Bangalore",Fast Food,₹400,"11AM to 11PM (Mon-Thu),11AM to 12Midnight (Fri-Sun) ","3.7 ",61 votes
"Sambram Biriyani Paradise ",https://www.zomato.com/bangalore/sambram-biriyani-paradise-1-jp-nagar,Casual Dining,JP Nagar,"633, 100 Feet Ring Road, Dollar Layout, 3rd Phase, JP Nagar, Bangalore","Andhra, North Indian, Chinese, Biryani",₹450,"11:30AM to 3:30PM, 6:30PM to 10:30PM (Mon-Sun) ","2.8 ",12 votes
"Ambara Gardenia ",https://www.zomato.com/bangalore/ambara-gardenia-bannerghatta-road,Casual Dining,Bannerghatta Road,"1065/A, 5th Cross, 13th Main, 2nd floor,Vijaya Bank Layout, Bannerghatta Road, Bangalore","Andhra, North Indian, Chinese, Seafood",₹800,"11:30AM to 3:30PM, 6:30PM to 11PM (Mon-Sun) ","3.4 ",107 votes
"Achayyan's ",https://www.zomato.com/bangalore/achayyans-indiranagar,Quick Bites,Indiranagar,"2209, 80 Feet Road, Near BSNL Office, 2nd stage, Indiranagar, Bangalore","Kerala, South Indian",₹350,"12Noon to 4PM, 7PM to 10:30PM (Mon-Sat),12Noon to... ","3.3 ",355 votes
"Mystique Palate ",https://www.zomato.com/bangalore/mystique-palate-jayanagar,Quick Bites,Jayanagar,"615/1, 10th C Main,32nd Cross Road ,Janardhan Mansion, 4th Block, Jayanagar, Bangalore","Italian, Chinese",₹300,"12Noon to 10:30PM (Mon-Sun) ","NEW ",
"Not Just Parathas ",https://www.zomato.com/bangalore/not-just-parathas-kaggadasapura,Casual Dining,Kaggadasapura,"#2, 1st A Main, Vignan Nagar Main Road, Kaggadasapura, Bangalore","North Indian, Chinese",₹500,"11:30AM to 3PM, 6:30PM to 11PM (Mon-Sat),11:30AM to... ","3.4 ",86 votes
"Holige Mane ",https://www.zomato.com/bangalore/holige-mane-malleshwaram,Casual Dining,Malleshwaram,"27/1, 10th Cross, Yellappa Garden, Malleshwaram, Bangalore",South Indian,₹200,"10AM to 10PM (Mon-Sun) ","3.9 ",66 votes
"Indian Coffee House ",https://www.zomato.com/bangalore/indian-coffee-house-church-street,Quick Bites,Church Street,"19, Ground Floor, Church Street, Bangalore",South Indian,₹200,"8AM to 8:30PM (Mon-Sun) ","3.6 ",1064 votes
"Jus' Trufs ",https://www.zomato.com/bangalore/jus-trufs-jakkur,"Dessert Parlor,Café",Jakkur,"9, Jakkur Main Road, Jakkur, Bangalore","Desserts, Cafe, Pizza, Burger",₹850,"8:30AM to 10:30PM (Mon-Sun) ","3.6 ",351 votes
"Tiffanys ",https://www.zomato.com/bangalore/tiffanys-shanti-nagar,Casual Dining,Shanti Nagar,"114, K H Road, Shanti Nagar, Bangalore","Continental, Italian, Chinese, Indian","₹1,000","7:30AM to 11:30PM (Mon-Sun) ","3.2 ",20 votes
"Puliyogare Point ",https://www.zomato.com/bangalore/puliyogare-point-basavanagudi,Quick Bites,Basavanagudi,"81, East Anjaneya Street, NR Colony, Near Basavanagudi, Basavanagudi, Bangalore",South Indian,₹100,"7:30AM to 10PM (Mon-Sun) ","3.9 ",242 votes
"Chaat Junction ",https://www.zomato.com/bangalore/chaat-junction-1-bannerghatta-road,Quick Bites,Bannerghatta Road,"Durga Complex, Central Excise Layout, Phase 2, Tejaswini Nagar, Dodda Kamanahalli Area, Bannerghatta Road, Bangalore",Street Food,₹150,"3PM to 10PM (Mon-Sun) ","3.3 ",8 votes
"Donne Biriyani Mane ",https://www.zomato.com/bangalore/donne-biriyani-mane-kalyan-nagar,Casual Dining,Kalyan Nagar,"2116, 4th Cross, CMR Road,HBBR Layout,2nd Block, Kalyan Nagar, Bangalore",Biryani,₹300,"Closed (Mon),11:30AM to 4:30PM, 6:30PM to 10:30PM... ","3.2 ",29 votes
"Lobby Cafe - Radha Regent ",https://www.zomato.com/bangalore/lobby-cafe-radha-regent-electronic-city,Casual Dining,"Radha Regent Bengaluru, Electronic City","Radha Regent Bengaluru, 110 C, Electronic City, Bangalore","Continental, American, South Indian, Italian, North Indian, Chinese","₹1,200","24 Hours (Mon-Sun) ","3.3 ",113 votes
"Memories of China - Vivanta By Taj ",https://www.zomato.com/bangalore/memories-of-china-vivanta-by-taj-mg-road,Fine Dining,"Vivanta By Taj, MG Road","Vivanta By Taj, 41/3, MG Road, Bangalore",Chinese,"₹3,000","12:30PM to 3PM, 7PM to 11PM (Mon-Sun) ","4.1 ",392 votes
"BISO - Citrus Hotels ",https://www.zomato.com/bangalore/biso-citrus-hotels-cunningham-road,Casual Dining,"Citrus Hotels, Cunningham Road","Citrus Hotels, 34, Cunningham Road, Bangalore","North Indian, South Indian, Italian, Continental","₹1,100","24 Hours (Mon-Sun) ","3.5 ",127 votes
"Grills & Rolls ",https://www.zomato.com/bangalore/grills-rolls-jp-nagar,Quick Bites,JP Nagar,"17/1, SNVR Complex, Opposite Royal School, 24th Main, 18th Cross, JP Nagar, Bangalore","North Indian, Chinese, Fast Food, Rolls, Juices",₹350,"12:30PM to 10:30PM (Mon-Sun) ","2.5 ",162 votes
"Gokul Veg ",https://www.zomato.com/bangalore/gokul-veg-basavanagudi,Casual Dining,Basavanagudi,"1st Floor, GR Plaza, DVG Road, Near Gandhi Bazaar circle, Basavanagudi, Bangalore","North Indian, Chinese",₹500,"11AM to 10:30PM (Mon-Sun) ","3.5 ",221 votes
"Sukh Sagar ",https://www.zomato.com/bangalore/sukh-sagar-majestic,Casual Dining,Majestic,"10, 3rd Main Road, Gandhinagar, Majestic Area, Majestic, Bangalore","South Indian, North Indian",₹500,"7AM to 10PM (Mon-Sun) ","3.6 ",211 votes
"Tandoor Hut ",https://www.zomato.com/bangalore/tandoor-hut-koramangala-5th-block,Casual Dining,Koramangala 5th Block,"477, KHB Colony, Koramangala 5th Block, Bangalore","North Indian, Chinese",₹400,"11AM to 3:30PM, 7:30PM to 11PM (Mon-Sun) ","3.7 ",929 votes
"Punjabi Swag ",https://www.zomato.com/bangalore/punjabi-swag-btm,Casual Dining,BTM,"950, 16th Main Road, 2nd Stage, BTM, Bangalore","Biryani, Beverages, North Indian",₹500,"11AM to 11:27PM (Mon-Sun) ","3.7 ",217 votes
"Copper Chimney ",https://www.zomato.com/copper-whitefield,Casual Dining,"Phoenix Market City Mall, Whitefield","1st,Floor, Food Court, Phoenix Market City Mall, Whitefield, Bangalore","North Indian, Biryani","₹1,600","12Noon to 3:30PM, 7PM to 11PM (Mon-Sun) ","2.6 ",872 votes
"Chef All Nite ",https://www.zomato.com/bangalore/chef-all-nite-btm,,BTM,"7th Cross, 4th Block, Behind Ayyappa Temple, Madiwala, BTM, Bangalore","Chinese, North Indian",₹300,"7PM to 4AM (Mon-Sun) ","3.8 ",212 votes
"Kothanur Kitchen ",https://www.zomato.com/bangalore/kothanur-kitchen-1-hennur,Casual Dining,Hennur,"K Narayanapura Main Road, Narayanapura, Hennur, Bangalore",South Indian,₹350,"7:30AM to 10PM (Mon-Sun) ","3.3 ",9 votes
"BJ Friends Night Kitchen ",https://www.zomato.com/bangalore/bj-friends-night-kitchen-kr-puram,,KR Puram,"2, Dream House, 2nd Cross Mottappa Kempaiah Layout Anandpura, Mother Theresa school Road TC Palya, KR Puram, Bangalore","Fast Food, Italian, Continental, Pizza",₹350,"10PM to 5AM (Mon, Tue, Wed, Thu, Fri, Sun), 9PM to... ","3.1 ",18 votes
"The Milkshake Theory ",https://www.zomato.com/bangalore/the-milkshake-theory-indiranagar-bangalore,Beverage Shop,Indiranagar,"12th Main, 2nd Stage, Indiranagar, Bangalore",Beverages,₹250,"10:30AM to 10:30PM (Mon-Sun) ","NEW ",
"Nandighosha ",https://www.zomato.com/bangalore/nandighosha-marathahalli,Quick Bites,Marathahalli,"Near Innovative Multiplex, Tulasi Theatre Main Road, Marathahalli, Bangalore","Bengali, Seafood, Oriya, North Indian",₹400,"10:30AM to 11PM (Mon-Sun) ","3.6 ",88 votes
"Srinidhi Sagar ",https://www.zomato.com/bangalore/srinidhi-sagar-airport-road,Quick Bites,Old Airport Road,"4, 19th Main Road, 6th Cross, Kodihalli, Old Airport Road, Bangalore","North Indian, Chinese, Beverages, Ice Cream",₹300,"7AM to 11PM (Mon-Sun) ","3.5 ",125 votes
"The Hebbal Cafe - Courtyard By Marriott ",https://www.zomato.com/bangalore/the-hebbal-cafe-courtyard-by-marriott-hebbal,Fine Dining,"Courtyard by Marriott Bengaluru, Hebbal","Courtyard By Marriott, 2/55, Outer Ring Road, Opposite Lumbini Garden, Nagavara, Hebbal, Bangalore","Continental, North Indian","₹2,400","24 Hours (Mon-Sun) ","NEW ",
"Udupi Vaibhav ",https://www.zomato.com/bangalore/udupi-vaibhav-marathahalli,Casual Dining,Marathahalli,"2B, Indaus Icon, Opposite JP Morgan, Marathahalli, Bangalore","Chinese, North Indian, South Indian",₹400,"7AM to 11PM (Mon-Sun) ","3.6 ",35 votes
"Fiddler's Green ",https://www.zomato.com/bangalore/fiddlers-green-kalyan-nagar,"Casual Dining,Bar",Kalyan Nagar,"227, 7th Main Road, HRBR Layout 2nd Block, Kalyan Nagar, Bangalore","Continental, American, Indonesian, Asian, Thai","₹1,200","11:30AM to 1AM (Mon-Sun) ","3.7 ",42 votes
"Woods @ Wonderla Resort ",https://www.zomato.com/bangalore/woods-wonderla-resort-mysore-road,Casual Dining,Mysore Road,"Wonderla Resort, 28th KM, Mysore Road, Bangalore","North Indian, Italian, Chinese","₹1,000","7AM to 10:30AM, 12:30PM to 11:30PM (Mon-Sun) ","3.6 ",52 votes
"Le Cirque Signature - The Leela Palace ",https://www.zomato.com/bangalore/le-cirque-signature-the-leela-palace-airport-road,Fine Dining,"The Leela Palace, Old Airport Road","The Leela Palace, 23, Old Airport Road, Bangalore","French, Italian","₹6,000","6:30PM to 11:30PM (Mon-Sun) ","3.9 ",88 votes
"Jingo BBQ & Burgers ",https://www.zomato.com/bangalore/jingo-bbq-burgers-kammanahalli,Quick Bites,Kammanahalli,"582, 5th Main Road, St Thomas Town, Inasappa Layout, Kammanahalli, Bangalore","Burger, BBQ",₹500,"4PM to 11PM (Mon, Wed, Thu, Fri, Sat, Sun), Closed... ","3.2 ",10 votes
"Terracotta - Vivanta By Taj ",https://www.zomato.com/bangalore/terracotta-vivanta-by-taj-whitefield,Fine Dining,"Vivanta By Taj, Whitefield","Vivanta By Taj, ITPB, Whitefield, Bangalore","Afghani, North Indian, Lucknowi","₹3,000","12:30PM to 3PM, 7PM to 11PM (Mon-Sun) ","3.7 ",231 votes
"Akshaya Deluxe ",https://www.zomato.com/bangalore/akshaya-deluxe-new-bel-road,Casual Dining,New BEL Road,"21, BEL Road, Indian Bank, Chickkamaranahalli, New BEL Road, Bangalore","North Indian, Chinese",₹450,"12Noon to 11PM (Mon-Sun) ","3.4 ",171 votes
"Punjabi Dhaba ",https://www.zomato.com/bangalore/punjabi-dhaba-majestic,Casual Dining,Majestic,"254, Galaxy Plaza, Next to Kapali Theatre, S.C. Road, Seshadripuram Area, Majestic, Bangalore",North Indian,₹350,"12Noon to 1AM (Mon-Sun) ","3.3 ",56 votes
"R K Dosa Camp ",https://www.zomato.com/bangalore/r-k-dosa-camp-wilson-garden,Quick Bites,Wilson Garden,"320, 9th Cross, BTS Main Road, Wilson Garden, Bangalore",South Indian,₹150,"6:30AM to 11PM (Mon-Sun) ","3.7 ",62 votes
"Calcutta Diaries ",https://www.zomato.com/bangalore/calcutta-diaries-rammurthy-nagar,Quick Bites,Rammurthy Nagar,"Number 7, Raghavendra Circle, T.C Palya Main Road, Rammurthy Nagar, Bangalore","Bengali, Chinese, Mughlai",₹400,"12Noon to 11PM (Mon-Sun) ","3.5 ",78 votes
"Enigma Pub ",https://www.zomato.com/bangalore/enigma-pub-koramangala-5th-block,"Bar,Casual Dining",Koramangala 5th Block,"2, Opposite Canara Bank, 100 Feet Road","North Indian, Continental","₹1,400","11AM to 11PM (Mon, Tue, Wed, Thu, Sun), 11AM to 1AM... ","3.3 ",624 votes
"MoMo Cafe - Courtyard by Marriott ",https://www.zomato.com/bangalore/momo-cafe-courtyard-by-marriott-bellandur,Casual Dining,Courtyard & Fairfield by Marriott,"Courtyard by Marriott, Marathahalli-Sarjapur Outer Ring Road, Bellandur, Bangalore","Asian, North Indian, South Indian","₹2,000","24 Hours (Mon-Sun) ","3.7 ",115 votes
"Riwaz - The Ritz-Carlton ",https://www.zomato.com/bangalore/riwaz-the-ritz-carlton-residency-road,"Fine Dining,Bar",The Ritz-Carlton,"The Ritz-Carlton, 99, Residency Road, Bangalore",North Indian,"₹4,000","12:30PM to 3PM, 7PM to 11:30PM (Mon-Sun) ","3.8 ",198 votes
"The Roastery ",https://www.zomato.com/bangalore/the-roastery-kalyan-nagar,Café,Kalyan Nagar,"5th A Main Road, 2nd Block, HRBR Layout, Kalyan Nagar, Bangalore",Cafe,₹500,"10AM to 11PM (Mon-Thu),10AM to 12Midnight (Fri-Sun) ","4.0 ",70 votes
