Name,URL,Type,Location,Address,Cuisines,Cost_for_Two,Timings,Rating,Votes
"Chung Wah ",https://www.zomato.com/bangalore/chung-wah-bannerghatta-road,Casual Dining,Bannerghatta Road,"3, Arakere Gate, Bannerghatta Road, Bangalore",Chinese,₹800,"12Noon to 3PM, 7PM to 11PM (Mon-Sun) ","3.5 ",366 votes
"FireHouse - Bar & Kitchen ",https://www.zomato.com/bangalore/firehouse-bar-kitchen-hbr-layout,Pub,HBR Layout,"310, Opposite Indo Asian Academy, 3rd Block, Kammanahalli Service Road, Ring Road, HBR Layout, Bangalore","Continental, American, Chinese, BBQ, Salad, Indian, Italian","₹1,500","12Noon to 11:30PM (Mon, Tue, Thu), 12Noon to 1AM... ","3.8 ",622 votes
"Denny's Pub ",https://www.zomato.com/bangalore/dennys-pub-yelahanka,"Casual Dining,Pub",Yelahanka,"150/3, JNTR Mansion, Opposite RMZ Galleria Mall, BB Road, Yelahanka, Bangalore","North Indian, Mughlai, Chinese","₹1,000","12Noon to 11PM (Mon-Sun) ","3.5 ",92 votes
"Harima ",https://www.zomato.com/bangalore/harima-residency-road,Casual Dining,Residency Road,"131, 4th Floor, Devatha Plaza, Residency Road, Bangalore",Japanese,"₹2,000","12Noon to 11PM (Mon-Sun) ","4.1 ",513 votes
"Kaifu ",https://www.zomato.com/bangalore/kaifu-new-bel-road,Casual Dining,New BEL Road,"1, Sree Premprasad Complex, Opposite Ramaiah Hospital Gate, New BEL Road, Bangalore","Chinese, Asian",₹700,"11AM to 11PM (Mon-Sun) ","3.8 ",145 votes
"Time Traveller - Sai Vishram ",https://www.zomato.com/bangalore/time-traveller-sai-vishram-electronic-city,Casual Dining,Electronic City,"Sai Vishram Business Hotel, 144 - C/1, Kirloskar Road, Bommasandra Industrial Estate, Hebbagodi, Electronic City, Bangalore","Continental, North Indian","₹1,100","7AM to 10AM, 12Noon to 3PM, 7PM to 10PM (Mon-Sun) ","3.9 ",756 votes
"Lakeview Milkbar ",https://www.zomato.com/bangalore/lakeview-milkbar-mg-road,"Dessert Parlor,Café",MG Road,"89, Kannan Building, MG Road, Bangalore","Desserts, Cafe, Bakery",₹500,"9AM to 12Midnight (Mon-Sun) ","3.7 ",1193 votes
"20 Char - Sterlings MAC Hotel ",https://www.zomato.com/bangalore/20-char-sterlings-mac-hotel-airport-road,Casual Dining,Sterlings Mac Hotel,"Matthan Hotel, 134, HAL Old Airport Road, Old Airport Road, Bangalore","Chinese, Continental, North Indian, South Indian, Arabian","₹1,400","24 Hours (Mon-Sun) ","3.6 ",327 votes
"Berry'd Alive ",https://www.zomato.com/bangalore/berryd-alive-indiranagar,Dessert Parlor,Indiranagar,"1079, 12th Main, HAL 2nd Stage, Off 100 Feet Road, Indiranagar, Bangalore",Desserts,₹400,"12:30PM to 12Midnight (Mon-Sun) ","4.2 ",2175 votes
"Bahar Cafe ",https://www.zomato.com/bangalore/bahar-cafe-marathahalli,Casual Dining,Marathahalli,"Ground Floor, Vims Hospital Buidling, Opposite to More, Marathahalli, Bangalore","North Indian, Chinese, Andhra, South Indian, Hyderabadi",₹750,"12Noon to 11PM (Mon-Sun) ","3.5 ",307 votes
"Patio 805 ",https://www.zomato.com/bangalore/patio-805-jayanagar,Casual Dining,Jayanagar,"805, Ground Floor, 35C Cross, 9th Main, 4th Block, Jayanagar, Bangalore","Asian, North Indian","₹1,200","12:30PM to 12Midnight (Mon-Sun) ","NEW ",
"Trick Or Treat ",https://www.zomato.com/bangalore/trick-or-treat-brigade-road,Café,Brigade Road,"15 K-1, D Block, Next to St. Patrick's Church, Opposite to Printo","Cafe, Burger, Continental, Pizza, Steak",₹500,"12:30PM to 11PM (Mon-Sun) ","4.0 ",473 votes
"Doof ",https://www.zomato.com/bangalore/doof-1-electronic-city,,Electronic City,"35, Basapura Main Road, Dream Paradise Layout, Basapura, Electronic City, Bangalore","American, Continental, Steak, Sandwich, Fast Food, Italian, Burger, Wraps",₹450,"3PM to 3AM (Mon-Sun) ","NEW ",
"Gudguda Prime Cafe ",https://www.zomato.com/bangalore/gudguda-prime-cafe-koramangala-6th-block,Café,Koramangala 6th Block,"55, 1st Floor, 5th Cross Road, Koramangala 6th Block, Bangalore","Cafe, Continental, Chinese, Italian",₹800,"11AM to 1AM (Mon-Sun) ","4.0 ",555 votes
"Halli Mane ",https://www.zomato.com/bangalore/halli-mane-malleshwaram,Quick Bites,Malleshwaram,"3rd Cross, Sampige Road, Malleshwaram, Bangalore","South Indian, North Indian, Chinese, Juices",₹200,"6:30AM to 10:30PM (Mon-Sun) ","3.6 ",983 votes
"Royal Afghan - ITC Windsor ",https://www.zomato.com/bangalore/royal-afghan-itc-windsor-sankey-road,Fine Dining,ITC Windsor,"ITC Windsor, 25 Windsor Square, Sankey Road, Bangalore","North Indian, Mughlai","₹5,000","7:30PM to 11:30PM (Mon-Fri),12:30PM to 2:45PM... ","4.1 ",361 votes
"Red Onion ",https://www.zomato.com/bangalore/red-onion-shanti-nagar,Casual Dining,Shanti Nagar,"Money Chambers Double Road, Shanti Nagar, Bangalore","Biryani, North Indian, Chinese, Kebab",₹600,"11:30AM to 3:30PM, 6:30PM to 11PM (Mon-Sun) ","4.0 ",358 votes
"Prems Graama Bhojanam ",https://www.zomato.com/bangalore/prems-graama-bhojanam-jayanagar,Casual Dining,Jayanagar,"234, 32 A Cross 2nd Main Road, 7th Block, Jayanagar, Bangalore",South Indian,₹300,"12Noon to 3:30PM, 7PM to 10:30PM (Mon-Sun) ","4.2 ",178 votes
"Mamma Royale ",https://www.zomato.com/bangalore/mamma-royale-koramangala-5th-block,Casual Dining,Koramangala 5th Block,"20/A, KHB Colony, Koramangala 5th Block, Bangalore","Continental, Arabian, North Indian, Italian, Steak",₹550,"12Noon to 2:30AM (Mon-Sun) ","4.0 ",123 votes
"Hello Resto-Pub ",https://www.zomato.com/bangalore/hello-resto-pub-airport-road,Casual Dining,Old Airport Road,"Shop 157/A, Behind EGL Tech Park, Murugeshpalaya, Old Airport Road, Bangalore",Continental,₹700,"7:30AM to 12Midnight (Mon-Sun) ","3.9 ",222 votes
"Chinnaswamy Naidu Biriyani ",https://www.zomato.com/bangalore/chinnaswamy-naidu-biriyani-hsr,Casual Dining,HSR,"242, 9th Main,17th Cross, 6th Sector, HSR, Bangalore","Biryani, South Indian",₹600,"11AM to 11PM (Mon-Sun) ","3.5 ",594 votes
"Le Casse Croûte ",https://www.zomato.com/bangalore/le-casse-croûte-thippasandra,Quick Bites,Thippasandra,"1675, Ground Floor, 4th Cross, 9th Main, HAL 3rd Stage, Thippasandra, Bangalore","French, Street Food",₹450,"11:30AM to 11:15PM (Mon-Sun) ","4.0 ",291 votes
"Bean Flickers ",https://www.zomato.com/bangalore/bean-flickers-indiranagar,Café,Indiranagar,"1083,5th Cross, Opposite Corporation Bank, 12th Main, Indiranagar, Bangalore","Cafe, American, Fast Food",₹700,"10AM to 11PM (Mon-Sun) ","4.1 ",256 votes
"Benjarong ",https://www.zomato.com/bangalore/benjarong-ulsoor,Casual Dining,Ulsoor,"12/1, Ulsoor Road, Ulsoor, Bangalore","Thai, Asian","₹1,500","12:15PM to 3PM, 7PM to 11PM (Mon-Sun) ","4.1 ",751 votes
"Manjit Da Dhaba ",https://www.zomato.com/bangalore/manjit-da-dhaba-frazer-town,Casual Dining,Frazer Town,"107, 1st Floor, Wheeler Road, Near Railway Cross, Cox Town, Frazer Town, Bangalore",North Indian,₹250,"12Noon to 4PM, 7PM to 11PM (Mon, Wed, Thu, Fri, Sat... ","4.1 ",643 votes
"Marination ",https://www.zomato.com/bangalore/marination-marathahalli,Casual Dining,Marathahalli,"Kadubeesanahalli, Opposite JP Morgan, Marathahalli, Bangalore","American, Burger, Italian, North Indian, South Indian",₹800,"12Noon to 11:30PM (Mon, Tue, Wed, Sat, Sun), 12Noon... ","3.8 ",286 votes
"Tempteys ",https://www.zomato.com/bangalore/tempteys-btm,"Dessert Parlor,Beverage Shop",BTM,"386, 7th Main, MICO Layout, 2nd Stage, BTM, Bangalore","Desserts, Beverages",₹350,"12Midnight to 1:30AM, 10:30AM to 12Midnight (Mon-Sun) ","4.0 ",85 votes
"Black Mug Cafe ",https://www.zomato.com/bangalore/black-mug-cafe-bannerghatta-road,Café,Bannerghatta Road,"1-2, Near Bhaganagar Bus Stop, Shankarnaga Road, Bhaganagar Layout, Gottigere, Bannerghatta Road, Bangalore",Cafe,₹300,"10AM to 11PM (Mon-Sun) ","3.5 ",136 votes
"Biryani Kitchen ",https://www.zomato.com/bangalore/biryani-kitchen-whitefield,Food Court,"Inorbit Mall, Whitefield","FB 11, 1st Floor, Inorbit Mall, EPIP Area, Whitefield, Bangalore",Biryani,₹450,"11:30AM to 11PM (Mon-Sun) ","3.9 ",240 votes
"Spice It ",https://www.zomato.com/bangalore/spice-it-marathahalli,Casual Dining,"Ibis Bengaluru Techpark, Marathahalli","Ibis Bengaluru Techpark, Opposite RMZ Ecospace Business Park, Sarjapur Outer Ring Road, Marathahalli, Bangalore","North Indian, Chinese, Continental, Italian","₹1,500","6:30AM to 3PM, 6:30PM to 11:30PM (Mon-Sun) ","3.7 ",510 votes
"Tastybites.com ",https://www.zomato.com/bangalore/tastybites-com-whitefield-bangalore,,Whitefield,"Shop 3, #189, 5th Main, BEML Layout, Opposite Balaji Residency, Thubrahahlli, Whitefield, Bangalore","Fast Food, Street Food, Beverages",₹200,"3PM to 10PM (Mon-Sun) ","NEW ",
"Tunday Kababi ",https://www.zomato.com/bangalore/tunday-kababi-koramangala-5th-block,Casual Dining,Koramangala 5th Block,"479, KHB Colony, Koramangala 5th Block, Bangalore","North Indian, Kebab",₹500,"12Noon to 11PM (Mon-Sun) ","3.5 ",962 votes
"Roti Ghar ",https://www.zomato.com/bangalore/roti-ghar-basavanagudi,Casual Dining,Basavanagudi,"17, Gandhi Bazar Main Road, Gandhi Bazaar, Basavanagudi, Bangalore","North Indian, Chinese, South Indian",₹450,"7AM to 11PM (Mon-Sun) ","3.5 ",543 votes
"Guzzlers Inn ",https://www.zomato.com/bangalore/guzzlers-inn-brigade-road,Pub,Brigade Road,"48, Resthouse Road, Off Brigade Road, Brigade Road, Bangalore","North Indian, Chinese","₹1,100","11AM to 11:30PM (Mon, Tue, Wed, Thu, Sun), 11AM to... ","3.6 ",850 votes
"Willys Top Cafe ",https://www.zomato.com/bangalore/willys-top-cafe-jayanagar,Café,Jayanagar,"23, 3rd Floor, 26th Main Road, Opposite Ragigudda Arch, 9th Block Jayanagar, Bangalore","Cafe, Continental, Asian",₹750,"11AM to 11PM (Mon, Tue, Wed, Thu, Fri, Sun), 11AM to... ","3.7 ",166 votes
"Messy Eats ",https://www.zomato.com/bangalore/messy-eats-2-new-bel-road,"Bakery,Dessert Parlor",New BEL Road,"107, AG's Layout, New BEL Road, Bangalore RMV Extension","Bakery, Desserts",₹500,"11AM to 10PM (Mon-Thu),11AM to 11:30PM (Fri-Sun) ","3.6 ",65 votes
"Saaga - The Royale Senate Hotel ",https://www.zomato.com/bangalore/saaga-the-royale-senate-hotel-hebbal,Casual Dining,Hebbal,"24, Next to Baptist Hospital, Bellary Road, Hebbal, Bangalore","North Indian, Mangalorean, Chinese, Thai, Continental",₹900,"7AM to 10AM, 12Noon to 3PM, 7PM to 11PM (Mon-Sun) ","3.6 ",412 votes
"Royal Andaaz ",https://www.zomato.com/bangalore/royal-andaaz-mysore-road,Casual Dining,Mysore Road,"749/1, Airavatha Building, Mysore - Kengeri State Highway, Mysore Road, Bangalore","South Indian, North Indian, Chinese",₹900,"7AM to 11PM (Mon-Sun) ","3.8 ",190 votes
"Blend with Benefits ",https://www.zomato.com/bangalore/blend-with-benefits-hsr,Beverage Shop,HSR,"242, Nandana Plaza, 17th Cross, 9th Main Road, Sector 6, Bangalore, Bangalore, HSR, Bangalore","Beverages, Juices",₹200,"11AM to 12Midnight (Mon, Tue, Wed, Thu, Sun), 12Noon... ","3.6 ",63 votes
"Flames Pizza ",https://www.zomato.com/bangalore/flames-pizza-yelahanka,Casual Dining,Yelahanka,"792, 2nd Main Road, Mother Dairy Circle, Yelahanka New Town, Yelahanka, Bangalore",Pizza,₹600,"12Noon to 10:30PM (Mon-Sun) ","3.6 ",70 votes
"Sulemani Chichas ",https://www.zomato.com/bangalore/sulemani-chichas-koramangala-5th-block,,Koramangala 5th Block,"183, 5th Cross, Koramangala 5th Block, Bangalore","Biryani, Hyderabadi, Kebab",₹300,"Closed (Mon),12Noon to 11PM (Tue-Sun) ","3.7 ",81 votes
"CakeZone ",https://www.zomato.com/cakeszone,Bakery,Indiranagar,"346, 9th Main, 14th Cross, 2nd Stage, CMH Road, Indiranagar, Bangalore","Bakery, Desserts",₹500,"7AM to 12Midnight (Mon-Sun) ","4.0 ",463 votes
"Frootality ",https://www.zomato.com/bangalore/frootality-indiranagar,"Beverage Shop,Quick Bites",Indiranagar,"Ground Floor, Icon Mall, 12th Main, 5th Cross, HAL 2nd Stage, Indiranagar, Bangalore","Beverages, Healthy Food",₹350,"8AM to 3AM (Mon-Sun) ","3.9 ",87 votes
"Doodle ",https://www.zomato.com/bangalore/doodle-vasanth-nagar,Café,Vasanth Nagar,"46, 8th Main, Between 6th & 7th Cross, Vasanth Nagar, Bangalore","Cafe, Continental, Pizza, Fast Food",₹500,"10:30AM to 11PM (Mon-Sun) ","4.0 ",95 votes
"Fritz Haber ",https://www.zomato.com/bangalore/fritz-haber-1-hsr,Dessert Parlor,HSR,"1086/A, Twin Tulips, 18th Cross, 14th Main Road, Sector 3, HSR, Bangalore","Ice Cream, Desserts",₹300,"12Noon to 1AM (Mon-Sun) ","3.9 ",190 votes
"Taranga ",https://www.zomato.com/bangalore/taranga-rajarajeshwari-nagar,"Casual Dining,Bar",Rajarajeshwari Nagar,"1198/ A, 54/1 Uttarahalli Main Road, Channasandra, Above dominos pizza, Rajarajeshwari Nagar, Bangalore","Andhra, North Indian, Chinese",₹800,"11AM to 11PM (Mon-Sun) ","3.7 ",85 votes
"Refills Eatery And Beverages ",https://www.zomato.com/bangalore/refills-eatery-and-beverages-btm-bangalore,,BTM,"Building 5, 4th Cross, Maruthi Nagar, Madiwala, BTM, Bangalore, Bengaluru","North Indian, South Indian, Chinese",₹450,"12Noon to 4AM (Mon-Sun) ","NEW ",
"Ranganna Military Hotel ",https://www.zomato.com/bangalore/ranganna-military-hotel-jayanagar,Casual Dining,Jayanagar,"61, 1st Floor, KR Road, 7th Block, Jayanagar, Bangalore",South Indian,₹250,"Closed (Mon),7:30AM to 4PM, 7PM to 10PM (Tue-Sun) ","3.8 ",473 votes
"Bengaluru Baking Company - JW Marriott Bengaluru ",https://www.zomato.com/bangalore/bengaluru-baking-company-jw-marriott-bengaluru-lavelle-road,"Bakery,Café","JW Marriott Bengaluru, Lavelle Road","JW Marriott Bengaluru, 24/1, Vittal Mallya Road, Lavelle Road, Bangalore","Bakery, Cafe","₹1,400","9AM to 11PM (Mon-Sun) ","4.0 ",323 votes
"Shang Palace - Shangri-La Hotel ",https://www.zomato.com/bangalore/shang-palace-shangri-la-hotel-vasanth-nagar,Fine Dining,"Shangri-La Hotel, Vasanth Nagar ","Shangri-La Hotel, Vasanth Nagar, Bangalore","Chinese, Asian","₹1,800","12Noon to 3PM, 7PM to 11:30PM (Mon-Fri),12Noon to... ","3.9 ",202 votes
"KFC ",https://www.zomato.com/bangalore/kfc-kammanahalli,Quick Bites,Kammanahalli,"4M- 403, 80 Feet Road, Kammanahalli, Bangalore","Burger, Fast Food",₹400,"11AM to 11PM (Mon-Sun) ","2.8 ",283 votes
"Cafe Terra ",https://www.zomato.com/bangalore/cafe-terra-indiranagar,Café,Indiranagar,"846, Double Road, 1st stage, Indiranagar, Bangalore","Cafe, Fast Food",₹500,"8AM to 10:30PM (Mon-Sun) ","3.8 ",197 votes
"Manbhavan Premium Thali Restaurant ",https://www.zomato.com/bangalore/manbhavan-premium-thali-restaurant-whitefield,Casual Dining,"VR Bengaluru, Whitefield","10, 2nd Floor, VR Mall, VR Bengaluru, Whitefield Main Road, Whitefield, Bangalore","Hyderabadi, Gujarati, Maharashtrian","₹1,000","12Noon to 4PM, 7PM to 10:30PM (Mon-Sun) ","3.7 ",179 votes
"GRAZERS ",https://www.zomato.com/bangalore/grazers-1-jayanagar,Café,Jayanagar,"2, Old No-36, 8th F Main, 3rd Block, Jayanagar, Bangalore","Cafe, Italian, Continental, American",₹500,"11AM to 11PM (Mon-Sun) ","3.7 ",114 votes
"Gobble Up Churros ",https://www.zomato.com/bangalore/gobble-up-churros-indiranagar,"Café,Dessert Parlor",Indiranagar,"46, 80 Feet Road, Opposite BSNL Office, Indiranagar, Bangalore","Cafe, Desserts, Bakery",₹400,"11:30AM to 11PM (Mon-Fri),8AM to 11PM (Sat-Sun) ","4.0 ",229 votes
"Sanky's Burger House ",https://www.zomato.com/bangalore/sankys-burger-house-hennur,Quick Bites,Hennur,"50,Hennur Main Road, Hennur, Bangalore","Burger, Fast Food",₹500,"10AM to 11PM (Mon, Tue, Wed, Thu, Fri, Sun), 5:30PM... ","3.9 ",166 votes
"Rashtrakutas ",https://www.zomato.com/bangalore/rashtrakutas-hsr,Casual Dining,HSR,"85/6, 15th Cross, 19th Main, Sector 1, HSR, Bangalore","South Indian, Biryani",₹800,"12Noon to 3:30PM, 7PM to 10:30PM (Mon-Sat),7AM to... ","3.8 ",244 votes
"Dakshin Spice ",https://www.zomato.com/bangalore/dakshin-spice-marathahalli,Casual Dining,Marathahalli,"Opposite EMC-2, Above Nexa Showroom, Outer Ring Road, Mahadevapura, Marathahalli, Bangalore","South Indian, North Indian",₹800,"12Noon to 4PM, 7PM to 11PM (Mon-Sun) ","3.6 ",281 votes
"Sikori ",https://www.zomato.com/bangalore/sikori-kalyan-nagar-bangalore,Casual Dining,Kalyan Nagar,"409, 5th Main, 2nd Block, HRBR Layout, Kalyan Nagar, Bangalore","Street Food, North Indian",₹500,"7:30AM to 10:30PM (Mon-Sun) ","NEW ",
"The Square - Novotel ",https://www.zomato.com/bangalore/the-square-novotel-marathahalli,Casual Dining,"Novotel Bengaluru Techpark, Marathahalli","Novotel Bengaluru Techpark, Opposite RMZ Ecospace Business Park, Marathahalli - Sarjapur Outer Ring Road, Marathahalli, Bangalore","Continental, North Indian, Japanese, Italian","₹2,500","6:30AM to 11:30PM (Mon-Sun) ","4.0 ",637 votes
"Ruh's Cafe ",https://www.zomato.com/bangalore/ruhs-cafe-btm,Café,BTM,"294, 4th Floor, 7th Main, 7th Cross, Mico Employees Griha Nirmana Sangha Layout, 2nd Stage, BTM, Bangalore","Cafe, American, Italian, Continental, Chinese",₹500,"Closed (Mon),11AM to 11PM (Tue-Sun) ","3.8 ",349 votes
"Fort Kochi ",https://www.zomato.com/bangalore/fort-kochi-mg-road,Fine Dining,MG Road,"Level 5, 1 MG Road Mall, Trinity Circle, MG Road, Bangalore","Kerala, Seafood","₹1,800","11AM to 11PM (Mon-Sun) ","3.8 ",259 votes
"Bheema's ",https://www.zomato.com/bangalore/bheemas-church-street,Casual Dining,Church Street,"31, Church Street, Bangalore",Andhra,₹650,"12Noon to 3:30PM, 7PM to 10:30PM (Mon-Sun) ","3.6 ",586 votes
"Pappu Chaiwalla ",https://www.zomato.com/bangalore/pappu-chaiwalla-hsr,Quick Bites,HSR,"251, 19th Main, Opposite Gnan Srishti Scholl of Excellence, HSR, Bangalore",Fast Food,₹300,"7AM to 11PM (Mon-Sun) ","3.6 ",526 votes
"Hype - Shangri-La Hotel ",https://www.zomato.com/bangalore/hype-shangri-la-hotel-vasanth-nagar,Lounge,"Shangri-La Hotel, Vasanth Nagar ","Shangri-La Hotel, Vasanth Nagar, Bangalore",Finger Food,"₹3,000","5PM to 1AM (Mon-Sun) ","4.0 ",190 votes
"Rajathadri Food Fort ",https://www.zomato.com/bangalore/rajathadri-food-fort-jayanagar,Casual Dining,Jayanagar,"19/49, Near National College, 2nd Main, 31st Cross, 7th Block, Jayanagar, Bangalore","South Indian, North Indian",₹600,"7AM to 10:30PM (Mon-Sun) ","3.7 ",301 votes
"Le Jardin - The Oberoi ",https://www.zomato.com/bangalore/le-jardin-the-oberoi-mg-road,Fine Dining,"The Oberoi, MG Road","The Oberoi, 37-39, MG Road, Bangalore","European, Mediterranean, North Indian","₹3,000","7AM to 12:30AM (Mon-Sun) ","4.2 ",595 votes
"UB Cafe and Restaurant ",https://www.zomato.com/bangalore/ub-cafe-and-restaurant-koramangala-5th-block,Casual Dining,Koramangala 5th Block,"AJ Inc, 126, Ground Floor, KHB Colony, Koramangala 5th Block, Bangalore","North Indian, Chinese, Fast Food, Biryani",₹600,"9AM to 1AM (Mon-Sun) ","3.6 ",47 votes
"The Bawarchi ",https://www.zomato.com/bangalore/the-bawarchi-marathahalli,Casual Dining,Marathahalli,"65, 1st Floor, Near Isuzu Car Showroom, Karthik Nagar, Lrde Layout, Marathahalli, Bangalore","Hyderabadi, North Indian, Chinese",₹700,"12Noon to 4PM, 7PM to 2AM (Mon-Sun) ","2.3 ",194 votes
"Pot Biryani ",https://www.zomato.com/bangalore/pot-biryani-domlur,Quick Bites,Domlur,"267, Amarjyothi Layout, Near DELL, Domlur, Bangalore","North Indian, Biryani",₹550,"11:30AM to 10:30PM (Mon-Sun) ","3.6 ",120 votes
"Paratha Singh ",https://www.zomato.com/bangalore/paratha-singh-kalyan-nagar,Quick Bites,Kalyan Nagar,"401, Ground Floor, 5th Main, 2nd Block, HRBR Layout, Kalyan Nagar, Bangalore",North Indian,₹350,"12Noon to 11PM (Mon-Sun) ","3.5 ",50 votes
"The Ants Cafe & Store ",https://www.zomato.com/bangalore/the-ants-cafe-store-indiranagar,Café,Indiranagar,"2286/B, 1st Cross, 14th A Main, HAL 2nd Stage, Off 100 Feet Road, Indiranagar, Bangalore","Cafe, Italian","₹1,000","9AM to 8:30PM (Mon-Sun) ","3.7 ",1250 votes
"Feast India Co. ",https://www.zomato.com/bangalore/feast-india-co-cunningham-road,Casual Dining,Cunningham Road,"70, Cunningham Road, Bangalore","Awadhi, Bengali, North Indian","₹1,500","12Noon to 3:30PM, 7PM to 11PM (Mon-Sun) ","3.7 ",48 votes
"Naachiyar's ",https://www.zomato.com/bangalore/naachiyars-1-ulsoor,Casual Dining,Ulsoor,"36/1, Ground Floor, Haudin Road, Ulsoor, Bangalore",Chettinad,₹600,"12Noon to 4PM, 6:30PM to 11PM (Mon-Sun) ","3.3 ",36 votes
"Dalchini ",https://www.zomato.com/bangalore/dalchini-bellandur,Casual Dining,Bellandur,"55/2, Devarabisanahalli, Outer Ring Road, Bellandur, Bangalore",North Indian,₹700,"11:30AM to 12Midnight (Mon-Sun) ","3.5 ",121 votes
"Indian Kitchen ",https://www.zomato.com/bangalore/indian-kitchen-malleshwaram,Casual Dining,"Orion Mall, Malleshwaram","20, Upper Ground Floor, 26/1, Orion Mall, Brigade Gateway, 80 feet Road, Malleshwaram, Bangalore","North Indian, Mughlai","₹1,500","12Noon to 11:30PM (Mon-Sun) ","3.6 ",97 votes
"4 Seasons Restaurant ",https://www.zomato.com/bangalore/4-seasons-restaurant-kalyan-nagar,Casual Dining,Kalyan Nagar,"1st Floor, Lamcy Plaza, Opposite Tanishq Showrrom, HRBR, 2nd Block, Kalyan Nagar, Bangalore","North Indian, Seafood, Middle Eastern, Chinese","₹1,000","12Noon to 11PM (Mon-Sun) ","3.2 ",340 votes
"Hillstation Cafe ",https://www.zomato.com/bangalore/hillstation-cafe-hennur,Café,Hennur,"103, K.Narayanapura Main Road, Kothanur, Nagawara, Bangalore",Cafe,₹500,"12Noon to 8PM (Mon-Fri),9AM to 8PM (Sat),Closed (Sun) ","4.3 ",311 votes
"Le Charcoal Xpress ",https://www.zomato.com/bangalore/le-charcoal-xpress-hsr,Quick Bites,HSR,"2334, Aarush Arcade, 17th Cross, 1st Sector, HSR, Bangalore","Arabian, Rolls",₹500,"12:30PM to 11:30PM (Mon-Sun) ","3.7 ",122 votes
"Orbis Restaurant ",https://www.zomato.com/bangalore/orbis-restaurant-1-whitefield,Casual Dining,Whitefield,"147/1, Varthur Kodi, Opposite Columbia Asia Hospital, Ozean Road, Whitefield Main Road, Whitefield, Bangalore","Arabian, North Indian, Chinese, Salad",₹600,"11:30AM to 12Midnight (Mon-Sun) ","3.5 ",291 votes
"Pin Me Down ",https://www.zomato.com/bangalore/pin-me-down-btm-bangalore,Casual Dining,BTM,"29, Tavakere Main Road, Behind Forum Mall, Koramangala, Bangalore","Mexican, Italian",₹600,"11AM to 11PM (Mon-Sun) ","NEW ",
"BelgYum ",https://www.zomato.com/bangalore/belgyum-whitefield,Dessert Parlor,"Phoenix Market City Mall, Whitefield","2nd Floor, Phoenix Market City, Whitefield, Bangalore",Desserts,₹400,"10:30AM to 10:30PM (Mon-Sun) ","4.6 ",1616 votes
"Blue Ginger - The Taj West End ",https://www.zomato.com/bangalore/blue-ginger-the-taj-west-end-race-course-road,Fine Dining,"The Taj West End, Race Course Road","Taj West End, Race Course Road, Bangalore",Vietnamese,"₹3,200","12:30PM to 2:45PM, 7:30PM to 11PM (Mon-Sun) ","4.1 ",401 votes
"Fishing Boat - Hotel Goyal Residency ",https://www.zomato.com/bangalore/fishing-boat-hotel-goyal-residency-electronic-city,Casual Dining,Electronic City,"Hotel Goyal Residency, 17-C Keonics Electronic City, Opposite Symbiosis College, 1st Phase, Electronic City, Bangalore","Seafood, North Indian, Chinese",₹800,"11:30AM to 3:30PM, 6:30PM to 10:20PM (Mon-Sun) ","3.8 ",189 votes
"Delhi Walle ",https://www.zomato.com/bangalore/delhi-walle-marathahalli,Quick Bites,Marathahalli,"Next to US Pizza, Ring Road, Marathahalli, Bangalore","North Indian, Street Food",₹300,"11AM to 11PM (Mon-Sun) ","2.5 ",236 votes
"Archana's First Crush ",https://www.zomato.com/bangalore/archanas-first-crush-sarjapur-road,Bakery,Sarjapur Road,"Shop 3, Opp Oceanus Monarda, Kasavanhalli, Off Sarjapur Road, Bangalore","Bakery, Desserts",₹400,"9AM to 10PM (Mon),9AM to 9PM (Tue-Sun) ","3.3 ",23 votes
"Agarwal Food Service ",https://www.zomato.com/bangalore/agarwal-food-service-bannerghatta-road,,Bannerghatta Road,"Shop 4, Shankarnag Road, Near State Bank of India Gottigere, Bannerghatta Road, Bangalore","North Indian, Chinese, Biryani",₹250,"7:30AM to 11PM (Mon-Sun) ","3.7 ",96 votes
"The Terrace at Windmills Craftworks ",https://www.zomato.com/bangalore/the-terrace-at-windmills-craftworks-whitefield,Casual Dining,Windmills Craftworks,"331, Road No 5B, EPIP Area, Next to K.T.P.O, Whitefield, Bangalore",North Indian,"₹1,800","12Noon to 3PM, 7PM to 11PM (Mon-Sat),12Noon to 4PM... ","3.8 ",333 votes
"Freskka ",https://www.zomato.com/bangalore/freskka-new-bel-road,Casual Dining,New BEL Road,"2/4, 80 Feet Road, Poojari Layout, RMV Extension, New BEL Road, Bangalore","Italian, American, Asian, Continental, Mexican",₹700,"10AM to 11PM (Mon-Sun) ","3.7 ",653 votes
"Marzipan Cafe & Bakery ",https://www.zomato.com/bangalore/marzipan-cafe-bakery-ulsoor,"Café,Bakery",Ulsoor,"22, Ulsoor Road, (ground floor of Sunrise Chambers), Bangalore","Cafe, Mediterranean, Bakery, Greek",₹700,"11AM to 8PM (Mon-Thu),11AM to 9PM (Fri-Sat),Closed... ","4.0 ",270 votes
"Mint Masala ",https://www.zomato.com/bangalore/mint-masala-sadashiv-nagar,Casual Dining,Sadashiv Nagar,"384/1, Bashyam Circle, Sadashiv Nagar, Bangalore","Chinese, North Indian",₹800,"12Noon to 3:30PM, 7PM to 11PM (Mon-Fri),12Noon to... ","3.5 ",429 votes
"Snow'ora ",https://www.zomato.com/bangalore/snowora-koramangala-4th-block-bangalore,Dessert Parlor,Koramangala 4th Block,"772, Ground Floor, Peripheral Road, 80 Feet Road, Koramangala 4th Block, Bangalore","Desserts, Ice Cream, Beverages",₹400,"12Noon to 11:30PM (Mon-Sun) ","3.9 ",165 votes
"Sagar ",https://www.zomato.com/bangalore/sagar-seshadripuram-bangalore,Casual Dining,Seshadripuram,"30, Ground Floor, Nagappa Street, Nehru Circle, Seshadripuram, Bangalore","Fast Food, North Indian, Chinese",₹300,"12Noon to 12Midnight (Mon-Sun) ","NEW ",
"Suryawanshi ",https://www.zomato.com/bangalore/suryawanshi-whitefield,Casual Dining,Whitefield,"2nd Floor, Santosh Tower, 3rd Road, EPIP, Whitefield, Bangalore","Maharashtrian, Seafood",₹700,"9AM to 3:30PM, 7PM to 11PM (Mon-Tue),9AM to 11PM... ","3.8 ",726 votes
"Sorse ",https://www.zomato.com/sorse,Casual Dining,Whitefield,"33, Sundari Armadale, Whitefield Main Road, Adjacent to Forum Value Mall, Varthur Kodi, Whitefield, Bangalore",Bengali,₹750,"12Noon to 3:30PM, 7PM to 10:30PM (Mon, Wed, Thu... ","3.6 ",526 votes
"Cafe D'hide ",https://www.zomato.com/bangalore/cafe-dhide-koramangala-5th-block,Café,Koramangala 5th Block,"130, 1st Cross, Koramangala 5th Block, Bangalore","Cafe, American",₹600,"10AM to 11PM (Mon-Fri),8:30AM to 11PM (Sat-Sun) ","3.9 ",688 votes
